images-count,price-qualifier,new-home-flag,display_address,cover-images-default,cover-images-webp,floorplans-count,summary,property-labels,property-title,id,property-link,cover-image,price,floorplans?,for-sale?,agent-base-contact-url,agent-contact-url,agent-details-url,agent-development?,agent-display-logo-url,agent-id,agent-name,agent-telephone
16,Shared ownership,True,"3 Bedroom Apartment at Greenway at Beckton Parkside, Newham Way, Beckton E6",https://media.onthemarket.com/properties/8736555/1336099298/image-0-480x320.jpg,https://media.onthemarket.com/properties/8736555/1336099298/image-0-480x320.webp,1,3 bed Shared Ownership duplexes in Newham with Concierge and Gym | Online Viewings Available - Register your Interest,"['Reduced', 'Online viewing', 'New build']",3 bedroom apartment for sale,8736555,/details/8736555/,https://media.onthemarket.com/properties/8736555/1336099298/image-0-480x320.jpg,"£106,250",True,True,/agents/contact/8736555/,/agents/contact/8736555/?form-name=details-contact,/new-homes/developers/development/peabody-greenway-at-beckton-parkside/,True,https://media.onthemarket.com/agents/companies/10420/200617115741678/logo-100x65.png,54618,Peabody - Greenway at Beckton Parkside,020 8128 9462
1,,True,"Plot 295, Type BP31 at Beckton Parkside, Viking Gardens, Beckton E6",https://media.onthemarket.com/properties/9984925/1337323966/image-0-480x320.jpg,https://media.onthemarket.com/properties/9984925/1337323966/image-0-480x320.webp,,"This 2-bedroom apartment benefits from an open-plan kitchen, living and dining area, an en suite to bedroom 1, stylish family bathroom and a terrace. Access to the terrace is from the living area. Opening hours Monday 10:00 - 17:00 Tuesday 10:00 - 17:00 Wednesday 10:00 - 17:00 Thursday 10:00 -...","['Recently added', 'New build']",2 bedroom apartment for sale,9984925,/details/9984925/,https://media.onthemarket.com/properties/9984925/1337323966/image-0-480x320.jpg,"£391,500",,True,/agents/contact/9984925/,/agents/contact/9984925/?form-name=details-contact,/new-homes/developers/development/beckton-parkside-56008/,True,https://media.onthemarket.com/agents/companies/9968/210113122228420/logo-100x65.jpg,56008,Bellway Homes - Beckton Parkside,020 3641 3983
1,,True,"Plot 300, Type BP30 at Beckton Parkside, Viking Gardens, Beckton E6",https://media.onthemarket.com/properties/9984906/1337323944/image-0-480x320.jpg,https://media.onthemarket.com/properties/9984906/1337323944/image-0-480x320.webp,,"This apartment has three bedrooms - one of which benefits from an en suite shower room - a well-equipped family bathroom, an open-plan kitchen, living and dining area, and a balcony. Opening hours Monday 10:00 - 17:00 Tuesday 10:00 - 17:00 Wednesday 10:00 - 17:00 Thursday 10:00 - 17:00 Friday...","['Recently added', 'New build']",3 bedroom apartment for sale,9984906,/details/9984906/,https://media.onthemarket.com/properties/9984906/1337323944/image-0-480x320.jpg,"£442,000",,True,/agents/contact/9984906/,/agents/contact/9984906/?form-name=details-contact,/new-homes/developers/development/beckton-parkside-56008/,True,https://media.onthemarket.com/agents/companies/9968/210113122228420/logo-100x65.jpg,56008,Bellway Homes - Beckton Parkside,020 3641 3983
1,,True,"Plot 286, Type BP28 at Beckton Parkside, Viking Gardens, Beckton E6",https://media.onthemarket.com/properties/9984879/1337323913/image-0-480x320.jpg,https://media.onthemarket.com/properties/9984879/1337323913/image-0-480x320.webp,,"This 2-bedroom home features an open-plan kitchen, living, and dining area, a modern bathroom and a terrace. Access to the terrace is from the living area. The apartment has a private ground-floor entrance. Opening hours Monday 10:00 - 17:00 Tuesday 10:00 - 17:00 Wednesday 10:00 - 17:00 Thursday...","['Recently added', 'New build']",2 bedroom apartment for sale,9984879,/details/9984879/,https://media.onthemarket.com/properties/9984879/1337323913/image-0-480x320.jpg,"£415,000",,True,/agents/contact/9984879/,/agents/contact/9984879/?form-name=details-contact,/new-homes/developers/development/beckton-parkside-56008/,True,https://media.onthemarket.com/agents/companies/9968/210113122228420/logo-100x65.jpg,56008,Bellway Homes - Beckton Parkside,020 3641 3983
1,,True,"Plot 307, Type BP29 at Beckton Parkside, Viking Gardens, Beckton E6",https://media.onthemarket.com/properties/9984886/1337323922/image-0-480x320.jpg,https://media.onthemarket.com/properties/9984886/1337323922/image-0-480x320.webp,,"This 1-bedroom home features an open-plan kitchen, living and dining area, a stylish bathroom and a balcony. Access to the balcony is by way of the living area. Opening hours Monday 10:00 - 17:00 Tuesday 10:00 - 17:00 Wednesday 10:00 - 17:00 Thursday 10:00 - 17:00 Friday 10:00 - 17:00 Saturday...","['Recently added', 'New build']",1 bedroom apartment for sale,9984886,/details/9984886/,https://media.onthemarket.com/properties/9984886/1337323922/image-0-480x320.jpg,"£300,500",,True,/agents/contact/9984886/,/agents/contact/9984886/?form-name=details-contact,/new-homes/developers/development/beckton-parkside-56008/,True,https://media.onthemarket.com/agents/companies/9968/210113122228420/logo-100x65.jpg,56008,Bellway Homes - Beckton Parkside,020 3641 3983
1,,True,"Plot 245, Type BP26 at Beckton Parkside, Viking Gardens, Beckton E6",https://media.onthemarket.com/properties/9984863/1337323840/image-0-480x320.jpg,https://media.onthemarket.com/properties/9984863/1337323840/image-0-480x320.webp,,"This 2-bedroom apartment extends over two floors. Both bedrooms are located on the lower level, as are the family bathroom and a separate shower room. Bedroom 1 also has private access to the large terrace. The open-plan kitchen, living and dining area, along with a cloakroom, are situated on the...","['Recently added', 'New build']",2 bedroom apartment for sale,9984863,/details/9984863/,https://media.onthemarket.com/properties/9984863/1337323840/image-0-480x320.jpg,"£434,500",,True,/agents/contact/9984863/,/agents/contact/9984863/?form-name=details-contact,/new-homes/developers/development/beckton-parkside-56008/,True,https://media.onthemarket.com/agents/companies/9968/210113122228420/logo-100x65.jpg,56008,Bellway Homes - Beckton Parkside,020 3641 3983
1,,True,"Plot 244, Type BP25 at Beckton Parkside, Viking Gardens, Beckton E6",https://media.onthemarket.com/properties/9984835/1337323803/image-0-480x320.jpg,https://media.onthemarket.com/properties/9984835/1337323803/image-0-480x320.webp,,"This 2-bedroom apartment extends over two floors. Both bedrooms are located on the lower level, as are the family bathroom and a separate shower room. Bedroom 1 also has private access to the first of two terraces. The open-plan kitchen, living and dining area, along with a cloakroom, are...","['Recently added', 'New build']",2 bedroom apartment for sale,9984835,/details/9984835/,https://media.onthemarket.com/properties/9984835/1337323803/image-0-480x320.jpg,"£444,500",,True,/agents/contact/9984835/,/agents/contact/9984835/?form-name=details-contact,/new-homes/developers/development/beckton-parkside-56008/,True,https://media.onthemarket.com/agents/companies/9968/210113122228420/logo-100x65.jpg,56008,Bellway Homes - Beckton Parkside,020 3641 3983
1,,True,"Plot 319, Type BP22 at Beckton Parkside, Viking Gardens, Beckton E6",https://media.onthemarket.com/properties/9984822/1337323788/image-0-480x320.jpg,https://media.onthemarket.com/properties/9984822/1337323788/image-0-480x320.webp,,"This 1-bedroom home features an open-plan kitchen, living and dining area, a stylish bathroom, and a terrace. Access to the terrace is from the living area. Opening hours Monday 10:00 - 17:00 Tuesday 10:00 - 17:00 Wednesday 10:00 - 17:00 Thursday 10:00 - 17:00 Friday 10:00 - 17:00 Saturday 10:00...","['Recently added', 'New build']",1 bedroom apartment for sale,9984822,/details/9984822/,https://media.onthemarket.com/properties/9984822/1337323788/image-0-480x320.jpg,"£288,000",,True,/agents/contact/9984822/,/agents/contact/9984822/?form-name=details-contact,/new-homes/developers/development/beckton-parkside-56008/,True,https://media.onthemarket.com/agents/companies/9968/210113122228420/logo-100x65.jpg,56008,Bellway Homes - Beckton Parkside,020 3641 3983
1,,True,"Plot 309, Type BP22 at Beckton Parkside, Viking Gardens, Beckton E6",https://media.onthemarket.com/properties/9984723/1337323564/image-0-480x320.jpg,https://media.onthemarket.com/properties/9984723/1337323564/image-0-480x320.webp,,"This 1-bedroom home features an open-plan kitchen, living and dining area, a stylish bathroom, and a terrace. Access to the terrace is from the living area. Opening hours Monday 10:00 - 17:00 Tuesday 10:00 - 17:00 Wednesday 10:00 - 17:00 Thursday 10:00 - 17:00 Friday 10:00 - 17:00 Saturday 10:00...","['Recently added', 'New build']",1 bedroom apartment for sale,9984723,/details/9984723/,https://media.onthemarket.com/properties/9984723/1337323564/image-0-480x320.jpg,"£285,500",,True,/agents/contact/9984723/,/agents/contact/9984723/?form-name=details-contact,/new-homes/developers/development/beckton-parkside-56008/,True,https://media.onthemarket.com/agents/companies/9968/210113122228420/logo-100x65.jpg,56008,Bellway Homes - Beckton Parkside,020 3641 3983
1,,True,"Plot 293, Type BP22 at Beckton Parkside, Viking Gardens, Beckton E6",https://media.onthemarket.com/properties/9984694/1337323502/image-0-480x320.jpg,https://media.onthemarket.com/properties/9984694/1337323502/image-0-480x320.webp,,"This 1-bedroom home features an open-plan kitchen, living and dining area, a stylish bathroom, and a terrace. Access to the terrace is from the living area. Opening hours Monday 10:00 - 17:00 Tuesday 10:00 - 17:00 Wednesday 10:00 - 17:00 Thursday 10:00 - 17:00 Friday 10:00 - 17:00 Saturday 10:00...","['Recently added', 'New build']",1 bedroom apartment for sale,9984694,/details/9984694/,https://media.onthemarket.com/properties/9984694/1337323502/image-0-480x320.jpg,"£280,500",,True,/agents/contact/9984694/,/agents/contact/9984694/?form-name=details-contact,/new-homes/developers/development/beckton-parkside-56008/,True,https://media.onthemarket.com/agents/companies/9968/210113122228420/logo-100x65.jpg,56008,Bellway Homes - Beckton Parkside,020 3641 3983
1,,True,"Plot 299, Type BP22 at Beckton Parkside, Viking Gardens, Beckton E6",https://media.onthemarket.com/properties/9984682/1337323470/image-0-480x320.jpg,https://media.onthemarket.com/properties/9984682/1337323470/image-0-480x320.webp,,"This 1-bedroom home features an open-plan kitchen, living and dining area, a stylish bathroom, and a terrace. Access to the terrace is from the living area. Opening hours Monday 10:00 - 17:00 Tuesday 10:00 - 17:00 Wednesday 10:00 - 17:00 Thursday 10:00 - 17:00 Friday 10:00 - 17:00 Saturday 10:00...","['Recently added', 'New build']",1 bedroom apartment for sale,9984682,/details/9984682/,https://media.onthemarket.com/properties/9984682/1337323470/image-0-480x320.jpg,"£283,000",,True,/agents/contact/9984682/,/agents/contact/9984682/?form-name=details-contact,/new-homes/developers/development/beckton-parkside-56008/,True,https://media.onthemarket.com/agents/companies/9968/210113122228420/logo-100x65.jpg,56008,Bellway Homes - Beckton Parkside,020 3641 3983
1,,True,"Plot 287, Type BP21 WCH at Beckton Parkside, Viking Gardens, Beckton E6",https://media.onthemarket.com/properties/9984660/1337323383/image-0-480x320.jpg,https://media.onthemarket.com/properties/9984660/1337323383/image-0-480x320.webp,,"This 2-bedroom home features an open-plan kitchen, living, and dining area, an en suite to bedroom 1, a stylish bathroom and a terrace. Access to the terrace is from both the living area and bedroom 1. Opening hours Monday 10:00 - 17:00 Tuesday 10:00 - 17:00 Wednesday 10:00 - 17:00 Thursday 10:00...","['Recently added', 'New build']",2 bedroom apartment for sale,9984660,/details/9984660/,https://media.onthemarket.com/properties/9984660/1337323383/image-0-480x320.jpg,"£409,000",,True,/agents/contact/9984660/,/agents/contact/9984660/?form-name=details-contact,/new-homes/developers/development/beckton-parkside-56008/,True,https://media.onthemarket.com/agents/companies/9968/210113122228420/logo-100x65.jpg,56008,Bellway Homes - Beckton Parkside,020 3641 3983
1,,True,"Plot 284, Type BP20 at Beckton Parkside, Viking Gardens, Beckton E6",https://media.onthemarket.com/properties/9984645/1337323362/image-0-480x320.jpg,https://media.onthemarket.com/properties/9984645/1337323362/image-0-480x320.webp,,"This 3-bedroom duplex apartment features a shower room, and an open-plan kitchen and dining room on the lower level. All bedrooms, the family bathroom, and the living room are situated on the upper level. The terrace is accessed from the living room. Opening hours Monday 10:00 - 17:00 Tuesday...","['Recently added', 'New build']",3 bedroom apartment for sale,9984645,/details/9984645/,https://media.onthemarket.com/properties/9984645/1337323362/image-0-480x320.jpg,"£480,000",,True,/agents/contact/9984645/,/agents/contact/9984645/?form-name=details-contact,/new-homes/developers/development/beckton-parkside-56008/,True,https://media.onthemarket.com/agents/companies/9968/210113122228420/logo-100x65.jpg,56008,Bellway Homes - Beckton Parkside,020 3641 3983
4,,True,"Plot 47, Raine House at New Market Place, Myrtle Road, East Ham, LONDON E6",https://media.onthemarket.com/properties/9970958/1337033651/image-0-480x320.jpg,https://media.onthemarket.com/properties/9970958/1337033651/image-0-480x320.webp,1,"A versatile studio apartment on the ground floor of Raine House with views of the podium gardens, featuring an open plan living/dining area and kitchen, with access to a private balcony. There is a separate bedspace and bathroom, while further benefits include ample storage space throughout....",['New build'],Studio for sale,9970958,/details/9970958/,https://media.onthemarket.com/properties/9970958/1337033651/image-0-480x320.jpg,"£308,000",True,True,/agents/contact/9970958/,/agents/contact/9970958/?form-name=details-contact,/new-homes/developers/development/new-market-place-51597/,True,https://media.onthemarket.com/agents/companies/9584/190805100244174/logo-100x65.png,51597,Barratt London - New Market Place,020 8128 9529
5,,True,"Plot 49, Raine House at New Market Place, Myrtle Road, East Ham, LONDON E6",https://media.onthemarket.com/properties/9970957/1337033650/image-0-480x320.jpg,https://media.onthemarket.com/properties/9970957/1337033650/image-0-480x320.webp,1,"If you’re a first time buyer, or simply looking for a great investment, this one bedroom apartment on the ground floor could be for you. It features an open plan kitchen living area which opens out on to a private balcony, bathroom and storage spaces. You can reach the nearest underground...",['New build'],1 bedroom apartment for sale,9970957,/details/9970957/,https://media.onthemarket.com/properties/9970957/1337033650/image-0-480x320.jpg,"£363,000",True,True,/agents/contact/9970957/,/agents/contact/9970957/?form-name=details-contact,/new-homes/developers/development/new-market-place-51597/,True,https://media.onthemarket.com/agents/companies/9584/190805100244174/logo-100x65.png,51597,Barratt London - New Market Place,020 8128 9529
5,,True,"Plot 238, St Pier Court at Upton Gardens, 1 Academy House, Thunderer Street, LONDON E13",https://media.onthemarket.com/properties/8881917/1336903520/image-0-480x320.jpg,https://media.onthemarket.com/properties/8881917/1336903520/image-0-480x320.webp,1,"Are you a first time buyer looking for outdoor space? This one double bedroom apartment comes with two private balconies with views from the first floor of St Pier Court and is available with London Help to Buy. The open plan, L shaped living and dining area includes a fully fitted kitchen with...",['New build'],1 bedroom apartment for sale,8881917,/details/8881917/,https://media.onthemarket.com/properties/8881917/1336903520/image-0-480x320.jpg,"£359,000",True,True,/agents/contact/8881917/,/agents/contact/8881917/?form-name=details-contact,/new-homes/developers/development/upton-gardens-51550/,True,https://media.onthemarket.com/agents/companies/9584/190805100244174/logo-100x65.png,51550,Barratt London - Upton Gardens,020 8022 3696
14,,True,"235 St Pier Court, Upton Gardens, Green Street, Upton Park, London, E13",https://media.onthemarket.com/properties/9956058/1336632664/image-0-480x320.jpg,https://media.onthemarket.com/properties/9956058/1336632664/image-0-480x320.webp,1,"Spacious 4 bedroom apartment benefiting from 2 private terraces and excellent transport connections available at Upton Gardens, E13  This marvellous 4 bedroom dual aspect apartment which is located on the ground floor of the St Pier Court building at Upton Gardens measures 1,228 sq/ft, benefits...","['Online viewing', 'New build']",4 bedroom flat for sale,9956058,/details/9956058/,https://media.onthemarket.com/properties/9956058/1336632664/image-0-480x320.jpg,"£556,000",True,True,/agents/contact/9956058/,/agents/contact/9956058/?form-name=details-contact,/agents/branch/knight-frank-city-and-east-residential-development/,False,https://media.onthemarket.com/agents/branches/37782/150609132133033/logo-100x65.jpg,37782,"Knight Frank - City & East, Residential Development",020 8022 6382
15,,True,"226 St Pier Court, Upton Gardens, Green Street, Upton Park, London, E13",https://media.onthemarket.com/properties/9955944/1336629650/image-0-480x320.jpg,https://media.onthemarket.com/properties/9955944/1336629650/image-0-480x320.webp,,"Spacious 3 bedroom home benefiting from 2 private balconies and excellent transport connections available at Upton Gardens  This elegant 3 bedroom apartment which is located on the 3rd floor of the St Pier Court building at Upton Gardens measures 1,016 square foot, benefits from 2 private...","['Online viewing', 'New build']",3 bedroom flat for sale,9955944,/details/9955944/,https://media.onthemarket.com/properties/9955944/1336629650/image-0-480x320.jpg,"£527,000",,True,/agents/contact/9955944/,/agents/contact/9955944/?form-name=details-contact,/agents/branch/knight-frank-city-and-east-residential-development/,False,https://media.onthemarket.com/agents/branches/37782/150609132133033/logo-100x65.jpg,37782,"Knight Frank - City & East, Residential Development",020 8022 6382
13,,True,"Apartment 216, St Pier Court, Upton Gardens -  Thunderer Street, London, E13",https://media.onthemarket.com/properties/9955796/1336622241/image-0-480x320.jpg,https://media.onthemarket.com/properties/9955796/1336622241/image-0-480x320.webp,1,"Elegant Two bedroom apartment with a private balcony and just a short walk away from Upton Park Station.  This modern 2 bedroom apartment is located on the second  floor of the St Pier Court building at Upton Gardens, measures  777 square foot, has a private balcony and a East aspect.  As a brand...","['Online viewing', 'New build', 'EV charger']",2 bedroom flat for sale,9955796,/details/9955796/,https://media.onthemarket.com/properties/9955796/1336622241/image-0-480x320.jpg,"£472,000",True,True,/agents/contact/9955796/,/agents/contact/9955796/?form-name=details-contact,/agents/branch/knight-frank-city-and-east-residential-development/,False,https://media.onthemarket.com/agents/branches/37782/150609132133033/logo-100x65.jpg,37782,"Knight Frank - City & East, Residential Development",020 8022 6382
6,,True,"Plot 235, St Pier Court at Upton Gardens, 1 Academy House, Thunderer Street, LONDON E13",https://media.onthemarket.com/properties/8581249/1336306432/image-0-480x320.jpg,https://media.onthemarket.com/properties/8581249/1336306432/image-0-480x320.webp,1,"This dual aspect apartment features three-bedrooms and two terraces and is located on the first floor of St Pier Court. The main bedroom features an en suite shower room and with hyperoptic broadband available, the third bedroom would make an ideal home office. There is an open plan living,...","['Reduced', 'New build', 'Study']",4 bedroom apartment for sale,8581249,/details/8581249/,https://media.onthemarket.com/properties/8581249/1336306432/image-0-480x320.jpg,"£556,000",True,True,/agents/contact/8581249/,/agents/contact/8581249/?form-name=details-contact,/new-homes/developers/development/upton-gardens-51550/,True,https://media.onthemarket.com/agents/companies/9584/190805100244174/logo-100x65.png,51550,Barratt London - Upton Gardens,020 8022 3696
16,Shared ownership,True,"3 Bedroom Apartment at Greenway at Beckton Parkside, Newham Way, Beckton E6",https://media.onthemarket.com/properties/8736555/1336099298/image-0-480x320.jpg,https://media.onthemarket.com/properties/8736555/1336099298/image-0-480x320.webp,1,3 bed Shared Ownership duplexes in Newham with Concierge and Gym | Online Viewings Available - Register your Interest,"['Reduced', 'Online viewing', 'New build']",3 bedroom apartment for sale,8736555,/details/8736555/,https://media.onthemarket.com/properties/8736555/1336099298/image-0-480x320.jpg,"£106,250",True,True,/agents/contact/8736555/,/agents/contact/8736555/?form-name=details-contact,/new-homes/developers/development/peabody-greenway-at-beckton-parkside/,True,https://media.onthemarket.com/agents/companies/10420/200617115741678/logo-100x65.png,54618,Peabody - Greenway at Beckton Parkside,020 8128 9462
5,,True,"Plot 241, St Pier Court at Upton Gardens, 1 Academy House, Thunderer Street, LONDON E13",https://media.onthemarket.com/properties/8628224/1335154480/image-0-480x320.jpg,https://media.onthemarket.com/properties/8628224/1335154480/image-0-480x320.webp,1,"You could buy this one-bedroom home with a 5% deposit of £17,500 through London Help to Buy. Located on the 2nd floor of St Pier Court, this home features an open plan kitchen, lounge, dining area with fully integrated appliances leading out to a private balcony. The apartment also benefits from...",['New build'],1 bedroom apartment for sale,8628224,/details/8628224/,https://media.onthemarket.com/properties/8628224/1335154480/image-0-480x320.jpg,"£350,000",True,True,/agents/contact/8628224/,/agents/contact/8628224/?form-name=details-contact,/new-homes/developers/development/upton-gardens-51550/,True,https://media.onthemarket.com/agents/companies/9584/190805100244174/logo-100x65.png,51550,Barratt London - Upton Gardens,020 8022 3696
6,,True,"Plot 229, St Pier Court at Upton Gardens, 1 Academy House, Thunderer Street, LONDON E13",https://media.onthemarket.com/properties/7435032/1336047074/image-0-480x320.jpg,https://media.onthemarket.com/properties/7435032/1336047074/image-0-480x320.webp,1,"This dual aspect apartment features three double bedrooms and two balconies and is located on the fourth floor of St Pier Court. The main bedroom features an en suite shower room nd access onto balcony two. There is an open plan living/dining area with a fully integrated kitchen, a family...",['New build'],3 bedroom apartment for sale,7435032,/details/7435032/,https://media.onthemarket.com/properties/7435032/1336047074/image-0-480x320.jpg,"£530,000",True,True,/agents/contact/7435032/,/agents/contact/7435032/?form-name=details-contact,/new-homes/developers/development/upton-gardens-51550/,True,https://media.onthemarket.com/agents/companies/9584/190805100244174/logo-100x65.png,51550,Barratt London - Upton Gardens,020 8022 3696
6,,True,"Plot 222, St Pier Court at Upton Gardens, 1 Academy House, Thunderer Street, LONDON E13",https://media.onthemarket.com/properties/9836888/1336448622/image-0-480x320.jpg,https://media.onthemarket.com/properties/9836888/1336448622/image-0-480x320.webp,1,"This apartment is located on the second floor with two double bedrooms, family bathroom and a spacious open plan kitchen living area. From here you can access the private balcony. The main bedroom features an en suite shower room and there is an allocated storage space off of the hallway. Total...",['New build'],2 bedroom apartment for sale,9836888,/details/9836888/,https://media.onthemarket.com/properties/9836888/1336448622/image-0-480x320.jpg,"£472,000",True,True,/agents/contact/9836888/,/agents/contact/9836888/?form-name=details-contact,/new-homes/developers/development/upton-gardens-51550/,True,https://media.onthemarket.com/agents/companies/9584/190805100244174/logo-100x65.png,51550,Barratt London - Upton Gardens,020 8022 3696
