images-count,price-qualifier,new-home-flag,display_address,cover-images-default,cover-images-webp,floorplans-count,summary,property-labels,property-title,id,property-link,cover-image,price,floorplans?,for-sale?,base-contact-url,contact-url,details-url,development?,display-logo-url,name,telephone
8,,True,"Plot B1805, Block B - Type J at Brunel Street Works, Brunel Street Works, Silvertown Way, Canning Town E16",https://media.onthemarket.com/properties/9591419/1325605057/image-0-480x320.jpg,https://media.onthemarket.com/properties/9591419/1325605057/image-0-480x320.webp,1,"A 1 bedroom, eighteenth floor apartment which offers a fully fitted open-plan kitchen, living and dining area, a luxury bathroom, hallway storage and a balcony. The Master Bedroom also features a built-in wardrobe....",['New build'],1 bedroom apartment for sale,53195,/details/9591419/,https://media.onthemarket.com/properties/9591419/1325605057/image-0-480x320.jpg,"£490,000",True,True,/agents/contact/9591419/,/agents/contact/9591419/?form-name=details-contact,/new-homes/developers/development/brunel-street-works-53195/,True,https://media.onthemarket.com/agents/companies/9834/200625080909437/logo-100x65.jpg,Linden Homes - Brunel Street Works,020 8128 5125
14,,True,"Marco Polo Tower, Royal Wharf, E16",https://media.onthemarket.com/properties/9855287/1333479918/image-0-480x320.jpg,https://media.onthemarket.com/properties/9855287/1333479918/image-0-480x320.webp,1,"Spacious fourth floor three bedroom apartment c. 1,083 sqft in the Marco Polo Tower, Royal Wharf, E16. Spectacular river views south-east facing directly on the river with exceptional 428 sqft wraparound terrace. Secure underground parking included. ",['New build'],3 bedroom apartment for sale,56032,/details/9855287/,https://media.onthemarket.com/properties/9855287/1333479918/image-0-480x320.jpg,"£813,250",True,True,/agents/contact/9855287/,/agents/contact/9855287/?form-name=details-contact,/agents/branch/johns-and-co-royal-wharf/,False,https://media.onthemarket.com/agents/companies/1503/150611123935640/logo-100x65.jpg,Johns & Co - Royal Wharf,020 8115 9213
16,,True,"John Cabot House, Royal Wharf, E16",https://media.onthemarket.com/properties/9855252/1333479233/image-0-480x320.jpg,https://media.onthemarket.com/properties/9855252/1333479233/image-0-480x320.webp,1,"Superb fith floor dual aspect apartment in John Cabot House, Royal Wharf, E16. Offering an exceptional 836 sqft of internal space and 102 sqft private terrace. Royal Wharf offers 24hr concierge, state of the art gym and 25m pool as well as on-site restaurants, cafes and retail outlets.",['New build'],2 bedroom apartment for sale,56032,/details/9855252/,https://media.onthemarket.com/properties/9855252/1333479233/image-0-480x320.jpg,"£635,000",True,True,/agents/contact/9855252/,/agents/contact/9855252/?form-name=details-contact,/agents/branch/johns-and-co-royal-wharf/,False,https://media.onthemarket.com/agents/companies/1503/150611123935640/logo-100x65.jpg,Johns & Co - Royal Wharf,020 8115 9213
10,,True,"Corsair House, Royal Wharf, London, E16",https://media.onthemarket.com/properties/9855251/1333479231/image-0-480x320.jpg,https://media.onthemarket.com/properties/9855251/1333479231/image-0-480x320.webp,1,"Superb two bedroom, two bathroom apartment  located on the 10th floor of Corsair House, Royal Wharf. Offering 815 SqFt of internal space with south facing private balcony offering views towards the River Thames. 24h concierge and state of the art gym and pool.",['New build'],2 bedroom apartment for sale,56032,/details/9855251/,https://media.onthemarket.com/properties/9855251/1333479231/image-0-480x320.jpg,"£630,000",True,True,/agents/contact/9855251/,/agents/contact/9855251/?form-name=details-contact,/agents/branch/johns-and-co-royal-wharf/,False,https://media.onthemarket.com/agents/companies/1503/150611123935640/logo-100x65.jpg,Johns & Co - Royal Wharf,020 8115 9213
10,,True,"Park View Place, Royal Wharf, E16",https://media.onthemarket.com/properties/9840943/1333090612/image-0-480x320.jpg,https://media.onthemarket.com/properties/9840943/1333090612/image-0-480x320.webp,1,"Outstanding studio apartment in Park View Place, Royal Wharf, E16. West facing studio overlooking landscaped gardens offers 409 sqft of internal space and 57 sqft private balcony. Royal Wharf offers the best in modern living with 24hr concierge, state of the art gym with 25m lap pool and on-site...",['New build'],Studio for sale,56032,/details/9840943/,https://media.onthemarket.com/properties/9840943/1333090612/image-0-480x320.jpg,"£345,000",True,True,/agents/contact/9840943/,/agents/contact/9840943/?form-name=details-contact,/agents/branch/johns-and-co-royal-wharf/,False,https://media.onthemarket.com/agents/companies/1503/150611123935640/logo-100x65.jpg,Johns & Co - Royal Wharf,020 8115 9213
11,,True,"Argo, Goodluck Hope, London, E14",https://media.onthemarket.com/properties/9827658/1332652491/image-0-480x320.jpg,https://media.onthemarket.com/properties/9827658/1332652491/image-0-480x320.webp,1,"Located in one of the most exciting new developments to arrive in E14, Goodluck Hope. This excellent 3rd floor, two-bedroom two-bathroom apartment in the Argo Building is not to be missed.",['New build'],2 bedroom apartment for sale,27515,/details/9827658/,https://media.onthemarket.com/properties/9827658/1332652491/image-0-480x320.jpg,"£728,000",True,True,/agents/contact/9827658/,/agents/contact/9827658/?form-name=details-contact,/agents/branch/johns-and-co-new-providence-wharf/,False,https://media.onthemarket.com/agents/companies/1503/150611123935640/logo-100x65.jpg,Johns & Co - New Providence Wharf,020 8128 7187
10,,True,"Dawsonne House, London City Island, London, E14",https://media.onthemarket.com/properties/9827545/1332649347/image-0-480x320.jpg,https://media.onthemarket.com/properties/9827545/1332649347/image-0-480x320.webp,1,"Perched on the 10th floor of Dawsonne House, this sizeable east facing one bedroom apartment boast far spanning views of the river. Encompassing c.590 sq ft, the property comprises an open plan kitchen living area, double bedroom with built in storage, stylish bathroom and private balcony, c.64...",['New build'],1 bedroom apartment for sale,27515,/details/9827545/,https://media.onthemarket.com/properties/9827545/1332649347/image-0-480x320.jpg,"£460,000",True,True,/agents/contact/9827545/,/agents/contact/9827545/?form-name=details-contact,/agents/branch/johns-and-co-new-providence-wharf/,False,https://media.onthemarket.com/agents/companies/1503/150611123935640/logo-100x65.jpg,Johns & Co - New Providence Wharf,020 8128 7187
10,,True,"Saxon, Goodluck Hope, London, E14",https://media.onthemarket.com/properties/9827536/1332649332/image-0-480x320.jpg,https://media.onthemarket.com/properties/9827536/1332649332/image-0-480x320.webp,1,"Stunning two-bedroom, two-bathroom apartment situated on the 11th floor of Saxon, part of the exciting new Goodluck Hope development in E14.",['New build'],2 bedroom apartment for sale,27515,/details/9827536/,https://media.onthemarket.com/properties/9827536/1332649332/image-0-480x320.jpg,"£723,000",True,True,/agents/contact/9827536/,/agents/contact/9827536/?form-name=details-contact,/agents/branch/johns-and-co-new-providence-wharf/,False,https://media.onthemarket.com/agents/companies/1503/150611123935640/logo-100x65.jpg,Johns & Co - New Providence Wharf,020 8128 7187
11,,True,"Grantham House, London City Island, London, E14",https://media.onthemarket.com/properties/9827439/1332646813/image-0-480x320.jpg,https://media.onthemarket.com/properties/9827439/1332646813/image-0-480x320.webp,1,"Stylish one bedroom apartment situated on the 3rd floor of Grantham House, part of the popular London City Island development. The apartment is spread across a spacious c.541 sq ft and comprises an open plan kitchen / living area with oak engineered flooring and direct access to a private balcony...",['New build'],1 bedroom apartment for sale,27515,/details/9827439/,https://media.onthemarket.com/properties/9827439/1332646813/image-0-480x320.jpg,"£440,000",True,True,/agents/contact/9827439/,/agents/contact/9827439/?form-name=details-contact,/agents/branch/johns-and-co-new-providence-wharf/,False,https://media.onthemarket.com/agents/companies/1503/150611123935640/logo-100x65.jpg,Johns & Co - New Providence Wharf,020 8128 7187
8,,True,"Modena House, London City Island, London, E14",https://media.onthemarket.com/properties/9827422/1332646508/image-0-480x320.jpg,https://media.onthemarket.com/properties/9827422/1332646508/image-0-480x320.webp,1,"Spacious studio apartment with private balcony located on the 14th floor of Modena House, part of the popular London City Island development.",['New build'],Studio for sale,27515,/details/9827422/,https://media.onthemarket.com/properties/9827422/1332646508/image-0-480x320.jpg,"£370,000",True,True,/agents/contact/9827422/,/agents/contact/9827422/?form-name=details-contact,/agents/branch/johns-and-co-new-providence-wharf/,False,https://media.onthemarket.com/agents/companies/1503/150611123935640/logo-100x65.jpg,Johns & Co - New Providence Wharf,020 8128 7187
7,,True,"Orchard Wharf, Poplar, E14",https://media.onthemarket.com/properties/9805981/1336991125/image-0-480x320.jpg,https://media.onthemarket.com/properties/9805981/1336991125/image-0-480x320.webp,1,1 Bedroom | 1 Bathroom | 7th Floor | South Facing | 545 sq. ft. | Views Of the O2 & River Thames | Large 99 sq ft Blacony | Completion Q1 2022 | 24 Hour Concierge | Contemporary Outdoor Pavilion  | 7 Minutes From Crossrail | Presenting a Spacious one bedroom one bathroom luxury apartment situated...,['New build'],1 bedroom flat for sale,49335,/details/9805981/,https://media.onthemarket.com/properties/9805981/1336991125/image-0-480x320.jpg,"£470,000",True,True,/agents/contact/9805981/,/agents/contact/9805981/?form-name=details-contact,/agents/branch/fraser-and-co-new-homes/,False,https://media.onthemarket.com/agents/companies/8246/181023104736610/logo-100x65.jpg,Fraser & Co - New Homes,020 8033 5239
9,,True,"Emerald House, London City Island, London, E14",https://media.onthemarket.com/properties/9750914/1329790999/image-0-480x320.jpg,https://media.onthemarket.com/properties/9750914/1329790999/image-0-480x320.webp,1,"Spacious 3 bedroom apartment located on the first floor of Emerald House, part of the London City Island development in Docklands, E14 Located on the 1st floor, this spacious 1213 sq ft 3 bedroom apartment boasts of direct River Lea views. With a South East aspect and floor to ceiling windows,...",['New build'],3 bedroom apartment for sale,37798,/details/9750914/,https://media.onthemarket.com/properties/9750914/1329790999/image-0-480x320.jpg,"£814,000",True,True,/agents/contact/9750914/,/agents/contact/9750914/?form-name=details-contact,/agents/branch/cbre-london-canary-wharf/,False,https://media.onthemarket.com/agents/companies/2161/160421100530154/logo-100x65.png,"CBRE Residential - London, Canary Wharf",020 8022 6426
9,,True,"Albion House, London City Island, London, E14",https://media.onthemarket.com/properties/9750913/1329790997/image-0-480x320.jpg,https://media.onthemarket.com/properties/9750913/1329790997/image-0-480x320.webp,1,"South West facing 2 bedroom apartment with private balcony on the 7th floor of Albion House, London City Island, E14 Located on the 7th floor, this dual aspect 805 sq ft 2 bedroom apartment boasts of direct River Lea & Canary Wharf views. With a South West aspect and Crittall-style windows, this...",['New build'],2 bedroom apartment for sale,37798,/details/9750913/,https://media.onthemarket.com/properties/9750913/1329790997/image-0-480x320.jpg,"£677,000",True,True,/agents/contact/9750913/,/agents/contact/9750913/?form-name=details-contact,/agents/branch/cbre-london-canary-wharf/,False,https://media.onthemarket.com/agents/companies/2161/160421100530154/logo-100x65.png,"CBRE Residential - London, Canary Wharf",020 8022 6426
8,,True,"Plot C1209, Block C - Type 22 at Brunel Street Works, Brunel Street Works, Silvertown Way, Canning Town E16",https://media.onthemarket.com/properties/9722285/1329045609/image-0-480x320.jpg,https://media.onthemarket.com/properties/9722285/1329045609/image-0-480x320.webp,1,"This twelfth floor, 3 bedroom home features a fully fitted open-plan kitchen, living and dining area, 2 double bedrooms and a single bedroom, a luxury bathroom, a balcony and plenty of hallway storage. The Master Bedroom also offers a built-in wardrobe and ensuite....",['New build'],3 bedroom apartment for sale,53195,/details/9722285/,https://media.onthemarket.com/properties/9722285/1329045609/image-0-480x320.jpg,"£695,000",True,True,/agents/contact/9722285/,/agents/contact/9722285/?form-name=details-contact,/new-homes/developers/development/brunel-street-works-53195/,True,https://media.onthemarket.com/agents/companies/9834/200625080909437/logo-100x65.jpg,Linden Homes - Brunel Street Works,020 8128 5125
8,,True,"Plot B1601, Block B - Type K at Brunel Street Works, Brunel Street Works, Silvertown Way, Canning Town E16",https://media.onthemarket.com/properties/8556969/1329045606/image-0-480x320.jpg,https://media.onthemarket.com/properties/8556969/1329045606/image-0-480x320.webp,1,"With 2 spacious double bedrooms, this sixteenth floor apartment features a fully fitted open-plan kitchen, living and dining area, a luxury bathroom, plenty of storage and a balcony. The Master Bedroom also comes with a built-in wardrobe and ensuite....",['New build'],2 bedroom apartment for sale,53195,/details/8556969/,https://media.onthemarket.com/properties/8556969/1329045606/image-0-480x320.jpg,"£595,000",True,True,/agents/contact/8556969/,/agents/contact/8556969/?form-name=details-contact,/new-homes/developers/development/brunel-street-works-53195/,True,https://media.onthemarket.com/agents/companies/9834/200625080909437/logo-100x65.jpg,Linden Homes - Brunel Street Works,020 8128 5125
35,,True,"Pinnacle House, Royal Wharf, Royal Docks, E16",https://media.onthemarket.com/properties/9716726/1337277591/image-0-480x320.jpg,https://media.onthemarket.com/properties/9716726/1337277591/image-0-480x320.webp,1,"Amazing Canary Wharf views!  | 692 sq. ft. | 312sqft Balcony | West facing | 7th Floor | Swimming Pool | EWS1 Cladding Certificate Pass - Grade A1| 24hr Concierge & Security | Onsite Shops, Restaurants and Coffee Shops | Gym | Indoor pool | Spa | 999 year lease from 2014 | Short walk to Pontoon...","['Online viewing', 'New build']",1 bedroom apartment for sale,26009,/details/9716726/,https://media.onthemarket.com/properties/9716726/1337277591/image-0-480x320.jpg,"£500,000",True,True,/agents/contact/9716726/,/agents/contact/9716726/?form-name=details-contact,/agents/branch/mylondonhome/,False,https://media.onthemarket.com/agents/branches/26009/190704130428048/logo-100x65.jpg,MyLondonHome,020 8033 1702
6,,True,"Discovery Tower, Royal Docks, E16",https://media.onthemarket.com/properties/9716389/1328862224/image-0-480x320.jpg,https://media.onthemarket.com/properties/9716389/1328862224/image-0-480x320.webp,1,"A beautifully presented 15th floor apartment boasting two double bedrooms with built-in wardrobes, two bathrooms and a bright and airy open plan lounge/dining area through to the fully fitted kitchen. The apartment enjoys a Westerly aspect and boasts a large balcony with views across London....",['New build'],2 bedroom apartment for sale,48092,/details/9716389/,https://media.onthemarket.com/properties/9716389/1328862224/image-0-480x320.jpg,"£580,000",True,True,/agents/contact/9716389/,/agents/contact/9716389/?form-name=details-contact,/agents/branch/regent-letting-and-property-management-waterloo/,False,https://media.onthemarket.com/agents/companies/7571/200309172310578/logo-100x65.jpg,Regent Letting & Property Management - Waterloo,020 8033 9950
31,,True,"Fairwater House, Royal Wharf, Royal Docks, E16",https://media.onthemarket.com/properties/4465584/1332535963/image-0-480x320.jpg,https://media.onthemarket.com/properties/4465584/1332535963/image-0-480x320.webp,1,"Amazing Canary Wharf views & River Views! | 887 sq. ft. + 123sqft Balcony | West facing | 5th Floor | Swimming Pool | 24hr Concierge & Security | Onsite Shops, Restaurants and Coffee Shops | Gym | Indoor pool | Spa | 999 year lease from 2014 | Short walk to Pontoon Dock DLR | Amazing access to...",['New build'],2 bedroom apartment for sale,26009,/details/4465584/,https://media.onthemarket.com/properties/4465584/1332535963/image-0-480x320.jpg,"£650,000",True,True,/agents/contact/4465584/,/agents/contact/4465584/?form-name=details-contact,/agents/branch/mylondonhome/,False,https://media.onthemarket.com/agents/branches/26009/190704130428048/logo-100x65.jpg,MyLondonHome,020 8033 1702
8,,True,"Defoe House, London City Island, London, E14",https://media.onthemarket.com/properties/9712698/1328738305/image-0-480x320.jpg,https://media.onthemarket.com/properties/9712698/1328738305/image-0-480x320.webp,1,"Luxury 18th floor two bedroom apartment with a private balcony located in London's new island metropolis London City Island, E14 Located on the 18th floor, this 2 bedroom 844 sq ft, high floor apartment with dual aspect Crittal windows, boasts of views into London City Island, framing views of...",['New build'],2 bedroom apartment for sale,37798,/details/9712698/,https://media.onthemarket.com/properties/9712698/1328738305/image-0-480x320.jpg,"£780,000",True,True,/agents/contact/9712698/,/agents/contact/9712698/?form-name=details-contact,/agents/branch/cbre-london-canary-wharf/,False,https://media.onthemarket.com/agents/companies/2161/160421100530154/logo-100x65.png,"CBRE Residential - London, Canary Wharf",020 8022 6426
16,,True,"Echo Court, Royal Wharf, London",https://media.onthemarket.com/properties/7773179/1328423760/image-0-480x320.jpg,https://media.onthemarket.com/properties/7773179/1328423760/image-0-480x320.webp,1,"A triple aspect three bedroom apartment with river views, totalling nearly 1,400 sq ft, available chain free through Prime London. Royal Wharf is conveniently located between Pontoon Dock and Custom House DLR stations with speedy access to Canary Wharf in 12 minutes and London City Airport in 4",['New build'],3 bedroom apartment for sale,44266,/details/7773179/,https://media.onthemarket.com/properties/7773179/1328423760/image-0-480x320.jpg,"£729,950",True,True,/agents/contact/7773179/,/agents/contact/7773179/?form-name=details-contact,/agents/branch/prime-london-central-and-riverside-london/,False,https://media.onthemarket.com/agents/branches/44266/180312100056548/logo-100x65.jpg,"Prime London, Central and Riverside - London",020 3641 9206
9,,True,"Amelia House, London City Island, E14",https://media.onthemarket.com/properties/8702957/1327453879/image-0-480x320.jpg,https://media.onthemarket.com/properties/8702957/1327453879/image-0-480x320.webp,,Dockleys are delighted to offer this stylish and spacious two double bedroom apartment in the highly sought after London City Island Development by Ballymore-ECO World.  Spanning a sizeable 1260 sq.ft and situated on the Ground and 1st floor the apartment offers an open plan kitchen/living space...,['New build'],3 bedroom apartment for sale,48486,/details/8702957/,https://media.onthemarket.com/properties/8702957/1327453879/image-0-480x320.jpg,"£855,000",,True,/agents/contact/8702957/,/agents/contact/8702957/?form-name=details-contact,/agents/branch/dockleys-london-property-london/,False,https://media.onthemarket.com/agents/companies/7785/201222175031108/logo-100x65.jpg,Dockleys London Property - London,020 8033 7485
10,,True,"Royal Albert Wharf, Parkside, Upper Dock Walk, Docklands, London, E16",https://media.onthemarket.com/properties/9647624/1337377727/image-0-480x320.jpg,https://media.onthemarket.com/properties/9647624/1337377727/image-0-480x320.webp,,"Parkside at Royal Albert Wharf is the new phase featuring beautiful 1, 2 and 3 bedroom apartments. Prices from £354,950.",['New build'],3 bedroom flat for sale,37739,/details/9647624/,https://media.onthemarket.com/properties/9647624/1337377727/image-0-480x320.jpg,"£635,000",,True,/agents/contact/9647624/,/agents/contact/9647624/?form-name=details-contact,/agents/branch/savills-canary-wharf-residential-development-sales/,False,https://media.onthemarket.com/agents/companies/4/161109164034707/logo-100x65.png,"Savills - Canary Wharf, Residential Development Sales",020 8022 6373
16,,True,"Orchard Place, London E14",https://media.onthemarket.com/properties/9639800/1335269179/image-0-480x320.jpg,https://media.onthemarket.com/properties/9639800/1335269179/image-0-480x320.webp,,"Chanin Estates offers a selection of one, two and three bedroom units available in a sought after Development by Ballymore Homes.A stunning array of nautical meets modern apartments on this unique island haven located directly on the River Thames at the historic Leamouth Peninsula.",['New build'],2 bedroom apartment for sale,47980,/details/9639800/,https://media.onthemarket.com/properties/9639800/1335269179/image-0-480x320.jpg,"£850,000",,True,/agents/contact/9639800/,/agents/contact/9639800/?form-name=details-contact,/agents/branch/chanin-estates-isle-of-dogs/,False,https://media.onthemarket.com/agents/companies/7487/180727154036422/logo-100x65.png,Chanin Estates - Isle of Dogs,020 8115 0051
6,,True,"John Cabot Building, E16",https://media.onthemarket.com/properties/9613852/1326061849/image-0-480x320.jpg,https://media.onthemarket.com/properties/9613852/1326061849/image-0-480x320.webp,1,"Presenting this spacious 1 BEDROOM 1 BATHROOM apartment located on the 3rd floor of Royal Wharf. This high spec apartment has 581 sq.ft* of internal space, and a balcony of 102 sq.ft*.Royal Wharf brings together everything that is best about London; large and small, local and regional, classic...",['New build'],1 bedroom flat for sale,49335,/details/9613852/,https://media.onthemarket.com/properties/9613852/1326061849/image-0-480x320.jpg,"£450,000",True,True,/agents/contact/9613852/,/agents/contact/9613852/?form-name=details-contact,/agents/branch/fraser-and-co-new-homes/,False,https://media.onthemarket.com/agents/companies/8246/181023104736610/logo-100x65.jpg,Fraser & Co - New Homes,020 8033 5239
