id,images-count,price-qualifier,new-home-flag,display_address,cover-images-default,cover-images-webp,floorplans-count,summary,property-labels,property-title,property-link,cover-image,price,floorplans?,for-sale?,agent-base-contact-url,agent-contact-url,agent-details-url,agent-development?,agent-display-logo-url,agent-id,agent-name,agent-telephone
7105562,12,Guide price,True,"Four5Two Finchley Road, NW11",https://media.onthemarket.com/properties/7105562/1327861027/image-0-480x320.jpg,https://media.onthemarket.com/properties/7105562/1327861027/image-0-480x320.webp,,"A three bedroom, two bathroom, first floor apartment in this deluxe new development of 13 apartments. With a contemporary design and a high spec finish Four5Two has been created for deluxe living on the borders of Hampstead and walking distance to Hampstead Heath. Backing on to Elm Park the...",['New build'],3 bedroom apartment for sale,/details/7105562/,https://media.onthemarket.com/properties/7105562/1327861027/image-0-480x320.jpg,"£1,500,000",,True,/agents/contact/7105562/,/agents/contact/7105562/?form-name=details-contact,/agents/branch/glentree-estates/,False,https://media.onthemarket.com/agents/companies/389/150611110859670/logo-100x65.jpg,3387,Glentree Estates,020 8022 6656
4488114,13,,True,"Apartment 6, Four5Two, Finchley Road, London, NW11",https://media.onthemarket.com/properties/4488114/1334707666/image-0-480x320.jpg,https://media.onthemarket.com/properties/4488114/1334707666/image-0-480x320.webp,1,"Large 3 bedroom apartment for sale

A spacious 3 bedroom open plan apartment featuring contemporary design and quality finish throughout. These apartments all have high ceilings and large terraces with park views.  

Bespoke fitted kitchens with integrated Siemens appliances. Tastefull...",['New build'],3 bedroom flat for sale,/details/4488114/,https://media.onthemarket.com/properties/4488114/1334707666/image-0-480x320.jpg,"£1,500,000",True,True,/agents/contact/4488114/,/agents/contact/4488114/?form-name=details-contact,/agents/branch/knight-frank-london-residential-development-broker-team/,False,https://media.onthemarket.com/agents/companies/5/180618174152145/logo-100x65.jpg,42119,"Knight Frank - London, Residential Development Broker Team",020 3641 9494
6882975,12,Guide price,True,"Belview Lodge, NW11",https://media.onthemarket.com/properties/6882975/1288649123/image-0-480x320.jpg,https://media.onthemarket.com/properties/6882975/1288649123/image-0-480x320.webp,1,"A stunning 3 bedroom, ground floor apartment of 1,470 sq ft available in this newly built boutique development of only 9 apartments. This apartment has a seperate kitchen and large reception, 3 generously sized bedrooms and 2 terraces with direct access to the communal gardens behind. Belview...",['New build'],3 bedroom apartment for sale,/details/6882975/,https://media.onthemarket.com/properties/6882975/1288649123/image-0-480x320.jpg,"£1,150,000",True,True,/agents/contact/6882975/,/agents/contact/6882975/?form-name=details-contact,/agents/branch/glentree-estates/,False,https://media.onthemarket.com/agents/companies/389/150611110859670/logo-100x65.jpg,3387,Glentree Estates,020 8022 6656
5849590,15,Guide price,True,"Chandos Way, Wellgarth Road, Golders Green, London, NW11",https://media.onthemarket.com/properties/5849590/1324736296/image-0-480x320.jpg,https://media.onthemarket.com/properties/5849590/1324736296/image-0-480x320.webp,1,"A new development for North London, Hampstead Reach has been designed to reflect the Arts & Crafts style of the neighbouring Hampstead Garden Suburb.",['New build'],2 bedroom flat for sale,/details/5849590/,https://media.onthemarket.com/properties/5849590/1324736296/image-0-480x320.jpg,"£995,000",True,True,/agents/contact/5849590/,/agents/contact/5849590/?form-name=details-contact,/agents/branch/savills-hampstead/,False,https://media.onthemarket.com/agents/companies/4/161109164034707/logo-100x65.png,22342,Savills - Hampstead,020 8022 7310
5625062,10,,True,"Hampstead Reach Apartments, Wellgarth Road, London, NW11",https://media.onthemarket.com/properties/5625062/1297121889/image-0-480x320.jpg,https://media.onthemarket.com/properties/5625062/1297121889/image-0-480x320.webp,1,"A two bedroom first floor flat with a balcony, underground parking and concierge in this exciting flagship development Hampstead Reach, the last of its kind in Hampstead Garden Suburb, set in a quiet location at the end of a tree lined cul-de-sac. (contd...)",['New build'],2 bedroom flat for sale,/details/5625062/,https://media.onthemarket.com/properties/5625062/1297121889/image-0-480x320.jpg,"£1,275,000",True,True,/agents/contact/5625062/,/agents/contact/5625062/?form-name=details-contact,/agents/branch/goldschmidt-and-howland-temple-fortune/,False,https://media.onthemarket.com/agents/companies/393/210106165907388/logo-100x65.jpeg,27550,Goldschmidt & Howland - Temple Fortune,020 8022 7063
