images-count,price-qualifier,new-home-flag,display_address,cover-images-default,cover-images-webp,floorplans-count,summary,property-labels,property-title,id,property-link,cover-image,price,floorplans?,for-sale?,base-contact-url,contact-url,details-url,development?,display-logo-url,name,telephone
17,,True,"Plot 2 Fettle Court at Deptford Foundry, 2 Molten Court, Moulding Lane SE14",https://media.onthemarket.com/properties/9789738/1331260683/image-0-480x320.jpg,https://media.onthemarket.com/properties/9789738/1331260683/image-0-480x320.webp,1,"2 Fettle Court is a superb 2 bedroom home spread across approx. 871 sq ft of living space, featuring a large private terrace with North West facing views. Located only 6 minutes away from London Bridge by train, this home is perfect for first time buyers wanting a shorter commute.","['Online viewing', 'New build']",2 bedroom apartment for sale,53628,/details/9789738/,https://media.onthemarket.com/properties/9789738/1331260683/image-0-480x320.jpg,"£545,000",True,True,/agents/contact/9789738/,/agents/contact/9789738/?form-name=details-contact,/new-homes/developers/development/deptford-foundry-53628/,True,https://media.onthemarket.com/agents/branches/53628/200228131642393/logo-100x65.jpg,Anthology - Deptford Foundry,020 3641 7677
24,,True,"Plot 20 Fettle Court at Deptford Foundry, 2 Molten Court, Moulding Lane SE14",https://media.onthemarket.com/properties/9786012/1331152814/image-0-480x320.jpg,https://media.onthemarket.com/properties/9786012/1331152814/image-0-480x320.webp,1,"20 Fettle Court is a stylish and modern 3 bedroom apartment spread across approximately 1,028 sq ft of living space, featuring an extremely large 796 sq ft wrap around private terrace for owners to enjoy. Located only 6 minutes by train from London Bridge.","['Online viewing', 'New build']",3 bedroom apartment for sale,53628,/details/9786012/,https://media.onthemarket.com/properties/9786012/1331152814/image-0-480x320.jpg,"£670,000",True,True,/agents/contact/9786012/,/agents/contact/9786012/?form-name=details-contact,/new-homes/developers/development/deptford-foundry-53628/,True,https://media.onthemarket.com/agents/branches/53628/200228131642393/logo-100x65.jpg,Anthology - Deptford Foundry,020 3641 7677
23,,True,"Plot 57 Cobalt Tower at Deptford Foundry, 2 Molten Court, Moulding Lane SE14",https://media.onthemarket.com/properties/9785917/1331150134/image-0-480x320.jpg,https://media.onthemarket.com/properties/9785917/1331150134/image-0-480x320.webp,1,"*AVAILABLE TO MOVE IN NOW* 57 Cobalt Tower is a stylish and modern 2 bedroom home spread across approx. 753 sq ft of living space, featuring a large dual aspect private balcony with fantastic views from the 21st floor. Located only 6 minutes train journey from London Bridge.","['Online viewing', 'New build']",2 bedroom apartment for sale,53628,/details/9785917/,https://media.onthemarket.com/properties/9785917/1331150134/image-0-480x320.jpg,"£630,000",True,True,/agents/contact/9785917/,/agents/contact/9785917/?form-name=details-contact,/new-homes/developers/development/deptford-foundry-53628/,True,https://media.onthemarket.com/agents/branches/53628/200228131642393/logo-100x65.jpg,Anthology - Deptford Foundry,020 3641 7677
11,,True,"Kingwood, Deptford Landings, Evelyn Street, Deptford, London, SE8",https://media.onthemarket.com/properties/9626850/1326327473/image-0-480x320.png,https://media.onthemarket.com/properties/9626850/1326327473/image-0-480x320.webp,2,"Deptford Landings brand new development available for sale on the Help to Buy scheme is spread across 11.6 acres, each building is designed in a contemporary architectural style that reflects and adds to the areas rich heritage. 12 min walk from Surrey Quays, 13 min walk from Deptford Rail","['Online viewing', 'New build']",2 bedroom flat for sale,27790,/details/9626850/,https://media.onthemarket.com/properties/9626850/1326327473/image-0-480x320.png,"£615,000",True,True,/agents/contact/9626850/,/agents/contact/9626850/?form-name=details-contact,/agents/branch/remax-property-group/,False,https://media.onthemarket.com/agents/branches/27790/171207115328787/logo-100x65.jpg,RE/MAX Property Group,020 8022 7388
14,,True,"Deptford Landings, 167 Grove Street, Deptford, London, SE8",https://media.onthemarket.com/properties/9626744/1326325426/image-0-480x320.jpg,https://media.onthemarket.com/properties/9626744/1326325426/image-0-480x320.webp,1,"Deptford Landings brand new development available for sale on the Help to Buy scheme is spread across 11.6 acres, each building is designed in a contemporary architectural style that reflects and adds to the areas rich heritage. 12 min walk from Surrey Quays, 13 min walk from Deptford Rail",['New build'],2 bedroom flat for sale,27790,/details/9626744/,https://media.onthemarket.com/properties/9626744/1326325426/image-0-480x320.jpg,"£596,000",True,True,/agents/contact/9626744/,/agents/contact/9626744/?form-name=details-contact,/agents/branch/remax-property-group/,False,https://media.onthemarket.com/agents/branches/27790/171207115328787/logo-100x65.jpg,RE/MAX Property Group,020 8022 7388
16,,True,"52 Cobalt Tower, Anthology Deptford Foundry, Arklow Road, London, SE8",https://media.onthemarket.com/properties/9597840/1336193797/image-0-480x320.jpg,https://media.onthemarket.com/properties/9597840/1336193797/image-0-480x320.webp,1,"Elegant Two bedroom apartment for sale at Anthology Deptford Foundry  This elegant two bedroom apartment is located on the 18th floor of Anthology Deptford Foundry's Cobalt Tower. The apartment measures 809 square foot, has North/West aspect and benefits from a private balcony.   Located in the...",['New build'],2 bedroom apartment for sale,37782,/details/9597840/,https://media.onthemarket.com/properties/9597840/1336193797/image-0-480x320.jpg,"£635,000",True,True,/agents/contact/9597840/,/agents/contact/9597840/?form-name=details-contact,/agents/branch/knight-frank-city-and-east-residential-development/,False,https://media.onthemarket.com/agents/branches/37782/150609132133033/logo-100x65.jpg,"Knight Frank - City & East, Residential Development",020 8022 6382
13,,True,"11 Cobalt Tower, Anthology Deptford Foundry, Arklow Road, London, SE8",https://media.onthemarket.com/properties/9524333/1335078317/image-0-480x320.jpg,https://media.onthemarket.com/properties/9524333/1335078317/image-0-480x320.webp,1,"One bedroom apartment benefiting from excellent transport connection available at Anthology Deptford Foundry, SE8  This beautiful one bedroom apartment is located on the 5th floor of Anthology Deptford Foundry's Cobalt Tower. The apartment measures 545 square foot and benefits from a private...",['New build'],1 bedroom flat for sale,37782,/details/9524333/,https://media.onthemarket.com/properties/9524333/1335078317/image-0-480x320.jpg,"£455,000",True,True,/agents/contact/9524333/,/agents/contact/9524333/?form-name=details-contact,/agents/branch/knight-frank-city-and-east-residential-development/,False,https://media.onthemarket.com/agents/branches/37782/150609132133033/logo-100x65.jpg,"Knight Frank - City & East, Residential Development",020 8022 6382
14,Offers in region of,True,"Trundleys road , Anayah Apartments, London SE8",https://media.onthemarket.com/properties/9501845/1325438088/image-0-480x320.jpg,https://media.onthemarket.com/properties/9501845/1325438088/image-0-480x320.webp,,A truly unique beautiful 2 bedrooms apartment offering large balcony also free off-street parking space for cars. House has 2 bathrooms and a modern kitchen equipped with gloss finished units and integrated appliances and complemented by high-quality fixtures and fitting.The superbly designed...,['New build'],2 bedroom flat for sale,45003,/details/9501845/,https://media.onthemarket.com/properties/9501845/1325438088/image-0-480x320.jpg,"£495,000",,True,/agents/contact/9501845/,/agents/contact/9501845/?form-name=details-contact,/agents/branch/property-m-dot-j-dalston/,False,https://media.onthemarket.com/agents/branches/45003/200907173429621/logo-100x65.jpg,Property M.J - Dalston,020 3641 0407
7,,True,"Cobalt Tower, Deptford Foundry, SE8",https://media.onthemarket.com/properties/8407181/1317866154/image-0-480x320.jpg,https://media.onthemarket.com/properties/8407181/1317866154/image-0-480x320.webp,1,"p>A spacious one-bedroom apartment located on the second floor of Cobalt Tower at Deptford Foundry. Anthology Deptford Foundry is an exclusive development in the unique and thriving location Deptford, South East London.  In the heart of one of south-east London’s most vibrant and creative...",['New build'],1 bedroom apartment for sale,22218,/details/8407181/,https://media.onthemarket.com/properties/8407181/1317866154/image-0-480x320.jpg,"£395,000",True,True,/agents/contact/8407181/,/agents/contact/8407181/?form-name=details-contact,/agents/branch/jll-london-new-homes/,False,https://media.onthemarket.com/agents/companies/547/170331113156299/logo-100x65.png,"JLL - London, New Homes",020 8022 7133
13,,True,"Deptford Broadway, London, SE8",https://media.onthemarket.com/properties/8197201/1317316543/image-0-480x320.jpg,https://media.onthemarket.com/properties/8197201/1317316543/image-0-480x320.webp,1,"48-49 Deptford Broadway is a small collection of unique new homes, tucked behind a Victorian building offering tranquillity from the nearby trendy Deptford High Street. (contd...)",['New build'],2 bedroom flat for sale,42593,/details/8197201/,https://media.onthemarket.com/properties/8197201/1317316543/image-0-480x320.jpg,"£350,000",True,True,/agents/contact/8197201/,/agents/contact/8197201/?form-name=details-contact,/agents/branch/keatons-deptford/,False,https://media.onthemarket.com/agents/companies/557/200123092130344/logo-100x65.png,Keatons - Deptford,020 8033 7465
21,,True,"Deptford Broadway, London, SE8",https://media.onthemarket.com/properties/8197198/1317316542/image-0-480x320.jpg,https://media.onthemarket.com/properties/8197198/1317316542/image-0-480x320.webp,1,"48-49 Deptford Broadway is a small collection of unique new homes, tucked behind a Victorian building offering tranquillity from the nearby trendy Deptford High Street. (contd...)",['New build'],3 bedroom flat for sale,42593,/details/8197198/,https://media.onthemarket.com/properties/8197198/1317316542/image-0-480x320.jpg,"£475,000",True,True,/agents/contact/8197198/,/agents/contact/8197198/?form-name=details-contact,/agents/branch/keatons-deptford/,False,https://media.onthemarket.com/agents/companies/557/200123092130344/logo-100x65.png,Keatons - Deptford,020 8033 7465
6,,True,"Deptford Broadway, London, SE8",https://media.onthemarket.com/properties/9309285/1317306098/image-0-480x320.jpg,https://media.onthemarket.com/properties/9309285/1317306098/image-0-480x320.webp,1,"This stunning, brand new one double bedroom apartment offers a fantastic location, in the heart of the popular Deptford.",['New build'],1 bedroom flat for sale,28257,/details/9309285/,https://media.onthemarket.com/properties/9309285/1317306098/image-0-480x320.jpg,"£300,000",True,True,/agents/contact/9309285/,/agents/contact/9309285/?form-name=details-contact,/agents/branch/kallars-london/,False,https://media.onthemarket.com/agents/companies/2904/201202132050065/logo-100x65.jpg,Kallars - London,020 8022 6775
13,Shared ownership,True,"Plot 206, 3 Bedroom Apartment at Deptford Landings, Evelyn Street SE8",https://media.onthemarket.com/properties/9084301/1336644449/image-1-480x320.jpg,https://media.onthemarket.com/properties/9084301/1336644449/image-1-480x320.webp,,"Brand new 3 bedroom homes available at L&Q at Deptford Landings, from £146,250, don't miss out! Reserve  by 28 Feb to receive up to £1,500* towards your moving costs!",['New build'],3 bedroom apartment for sale,55063,/details/9084301/,https://media.onthemarket.com/properties/9084301/1336644449/image-1-480x320.jpg,"£170,000",,True,/agents/contact/9084301/,/agents/contact/9084301/?form-name=details-contact,/new-homes/developers/development/deptford-landings-55063/,True,https://media.onthemarket.com/agents/companies/10636/200811101258055/logo-100x65.jpg,L&Q - Deptford Landings,020 3641 1629
13,Shared ownership,True,"Plot 002, 4 Bedroom Apartment at Deptford Landings, Timberyard St, Evelyn Street SE8",https://media.onthemarket.com/properties/9084348/1336643934/image-3-480x320.jpg,https://media.onthemarket.com/properties/9084348/1336643934/image-3-480x320.webp,,"Brand new 4 bedroom homes available at Lacewood Apartments, from £198,750, don't miss out! Reserve by 28 Feb to receive up to £1,500* towards your moving costs!",['New build'],4 bedroom apartment for sale,55063,/details/9084348/,https://media.onthemarket.com/properties/9084348/1336643934/image-3-480x320.jpg,"£198,750",,True,/agents/contact/9084348/,/agents/contact/9084348/?form-name=details-contact,/new-homes/developers/development/deptford-landings-55063/,True,https://media.onthemarket.com/agents/companies/10636/200811101258055/logo-100x65.jpg,L&Q - Deptford Landings,020 3641 1629
7,,True,"Meranti Apartments, Deptford Landings, Deptford SE8",https://media.onthemarket.com/properties/8507943/1293945946/image-0-480x320.jpg,https://media.onthemarket.com/properties/8507943/1293945946/image-0-480x320.webp,1,"1st floor, one bedroom apartment in Meranti Apartments, a constituent part of Deptford Landings SE8. Comprises a bright, spacious living space with floor-to-ceiling windows that open to a south-east facing balcony with garden views. A high end fitted kitchen suite with integrated Bosch...",['New build'],1 bedroom apartment for sale,45157,/details/8507943/,https://media.onthemarket.com/properties/8507943/1293945946/image-0-480x320.jpg,"£528,000",True,True,/agents/contact/8507943/,/agents/contact/8507943/?form-name=details-contact,/agents/branch/chase-evans-greenwich/,False,https://media.onthemarket.com/agents/companies/5426/180720152135892/logo-100x65.jpg,Chase Evans - Greenwich,020 8115 0994
18,,True,"Meranti Apartments, Deptford",https://media.onthemarket.com/properties/8827189/1304029515/image-0-480x320.jpg,https://media.onthemarket.com/properties/8827189/1304029515/image-0-480x320.webp,1,"A naturally bright South facing apartment in Lendlease's landmark Deptford Landings development.  Enjoying a spacious third floor balcony which overlooks the communal courtyard gardens below, this property has a bright open ambiance with few dividing walls and a great entertaining space.  Each...",['New build'],2 bedroom apartment for sale,44814,/details/8827189/,https://media.onthemarket.com/properties/8827189/1304029515/image-0-480x320.jpg,"£590,000",True,True,/agents/contact/8827189/,/agents/contact/8827189/?form-name=details-contact,/agents/branch/oliver-jaques-surrey-quays/,False,https://media.onthemarket.com/agents/branches/44814/180416092900470/logo-100x65.png,Oliver Jaques - Surrey Quays,020 8115 9965
18,,True,"Waterline Way, Deptford",https://media.onthemarket.com/properties/8822655/1329641295/image-0-480x320.jpg,https://media.onthemarket.com/properties/8822655/1329641295/image-0-480x320.webp,1,"A brand new, three bedroomed apartment occupying the fifth floor of Kingwood Apartments.  Entered from the brand new Waterline Way - a continuous linear park leading straight into the heart of Surrey Quays, Kingwood Apartments is an eleven storey development from Lendlease, which forms part of...",['New build'],3 bedroom apartment for sale,44814,/details/8822655/,https://media.onthemarket.com/properties/8822655/1329641295/image-0-480x320.jpg,"£695,000",True,True,/agents/contact/8822655/,/agents/contact/8822655/?form-name=details-contact,/agents/branch/oliver-jaques-surrey-quays/,False,https://media.onthemarket.com/agents/branches/44814/180416092900470/logo-100x65.png,Oliver Jaques - Surrey Quays,020 8115 9965
11,,True,"Kingwood Apartments, Deptford Landings, Deptford SE8",https://media.onthemarket.com/properties/8742110/1327180890/image-0-480x320.jpg,https://media.onthemarket.com/properties/8742110/1327180890/image-0-480x320.webp,1,"Brand new two bedroom, two bathroom 10th floor apartment with a balcony in Deptford Landings SE8. Comprising a spacious open plan kitchen/ living area with floor to ceiling windows leading to private balcony, two ample sized bedrooms, master en-suite with shower and a further, modern family...","['Online viewing', 'New build']",2 bedroom apartment for sale,45157,/details/8742110/,https://media.onthemarket.com/properties/8742110/1327180890/image-0-480x320.jpg,"£767,500",True,True,/agents/contact/8742110/,/agents/contact/8742110/?form-name=details-contact,/agents/branch/chase-evans-greenwich/,False,https://media.onthemarket.com/agents/companies/5426/180720152135892/logo-100x65.jpg,Chase Evans - Greenwich,020 8115 0994
9,,True,"Kingwood Apartments, Deptford Landings, Deptford SE8",https://media.onthemarket.com/properties/8649508/1311987829/image-0-480x320.jpg,https://media.onthemarket.com/properties/8649508/1311987829/image-0-480x320.webp,1,"8th floor, one bedroom, off contract reassignment within Cedarwood View, a constituent part of Deptford Landings SE8. Comprises a bright, spacious living space with floor-to-ceiling windows that open to a north-east facing balcony with park views. A high end fitted kitchen suite with integrated...","['Online viewing', 'New build']",1 bedroom apartment for sale,45157,/details/8649508/,https://media.onthemarket.com/properties/8649508/1311987829/image-0-480x320.jpg,"£425,000",True,True,/agents/contact/8649508/,/agents/contact/8649508/?form-name=details-contact,/agents/branch/chase-evans-greenwich/,False,https://media.onthemarket.com/agents/companies/5426/180720152135892/logo-100x65.jpg,Chase Evans - Greenwich,020 8115 0994
11,,True,"Meranti Apartments, Deptford Landings, Deptford SE8",https://media.onthemarket.com/properties/8579112/1334161112/image-0-480x320.jpg,https://media.onthemarket.com/properties/8579112/1334161112/image-0-480x320.webp,1,"Brand new 3rd floor two bedroom, two bathroom apartment with a balcony in Kingswood Apartments, Deptford Landings SE8. The light open plan kitchen/ living room extends onto the west facing balcony and overlooks the immaculately landscaped courtyard. The master bedroom is ensuite and there is a...","['Online viewing', 'New build']",2 bedroom apartment for sale,45157,/details/8579112/,https://media.onthemarket.com/properties/8579112/1334161112/image-0-480x320.jpg,"£590,000",True,True,/agents/contact/8579112/,/agents/contact/8579112/?form-name=details-contact,/agents/branch/chase-evans-greenwich/,False,https://media.onthemarket.com/agents/companies/5426/180720152135892/logo-100x65.jpg,Chase Evans - Greenwich,020 8115 0994
10,,True,"Deptford Broadway, London, SE8",https://media.onthemarket.com/properties/8529799/1317328224/image-0-480x320.jpg,https://media.onthemarket.com/properties/8529799/1317328224/image-0-480x320.webp,1,This stunning three bedroom duplex apartment is offered to the market chain free.,"['Online viewing', 'New build']",3 bedroom flat for sale,28257,/details/8529799/,https://media.onthemarket.com/properties/8529799/1317328224/image-0-480x320.jpg,"£475,000",True,True,/agents/contact/8529799/,/agents/contact/8529799/?form-name=details-contact,/agents/branch/kallars-london/,False,https://media.onthemarket.com/agents/companies/2904/201202132050065/logo-100x65.jpg,Kallars - London,020 8022 6775
5,,True,"Deptford Broadway, SE8",https://media.onthemarket.com/properties/8529798/1333027144/image-0-480x320.jpg,https://media.onthemarket.com/properties/8529798/1333027144/image-0-480x320.webp,1,This chain free two bedroom flat offers an excellent location in the heart of the popular Deptford.,"['Online viewing', 'New build']",2 bedroom flat for sale,28257,/details/8529798/,https://media.onthemarket.com/properties/8529798/1333027144/image-0-480x320.jpg,"£350,000",True,True,/agents/contact/8529798/,/agents/contact/8529798/?form-name=details-contact,/agents/branch/kallars-london/,False,https://media.onthemarket.com/agents/companies/2904/201202132050065/logo-100x65.jpg,Kallars - London,020 8022 6775
9,,True,"Kingwood Apartments, Deptford Landings, Deptford SE8",https://media.onthemarket.com/properties/8149665/1315702880/image-0-480x320.jpg,https://media.onthemarket.com/properties/8149665/1315702880/image-0-480x320.webp,,"Brand new, 9th floor, one bedroom apartment in the sought after Deptford Landings SE8. The naturally bright interior is open plan with kitchen and living room extending onto the balcony. There is an ample bedroom with a built-in wardrobe and a modern bathroom. Residents have access to a large...",['New build'],1 bedroom apartment for sale,45156,/details/8149665/,https://media.onthemarket.com/properties/8149665/1315702880/image-0-480x320.jpg,"£470,000",,True,/agents/contact/8149665/,/agents/contact/8149665/?form-name=details-contact,/agents/branch/chase-evans-elephant-and-castle/,False,https://media.onthemarket.com/agents/companies/5426/180720152135892/logo-100x65.jpg,Chase Evans - Elephant & Castle,020 8115 0997
15,,True,"2.B.05 AP1 Cedarwood View, Deptford Landings, 121-123 Evelyn Street, London, SE8",https://media.onthemarket.com/properties/7360373/1336091027/image-0-480x320.jpg,https://media.onthemarket.com/properties/7360373/1336091027/image-0-480x320.webp,1,"Charming 2 & 3 bedroom homes available at Deptford Landings  This modern dual aspect three bedroom apartment, located on the 5th floor of Cedarwood View, measures 1011 square foot of internal space and includes an East facing balcony with a Garden view.  Deptford Landings is a brand new...","['Online viewing', 'New build']",3 bedroom flat for sale,37782,/details/7360373/,https://media.onthemarket.com/properties/7360373/1336091027/image-0-480x320.jpg,"£695,000",True,True,/agents/contact/7360373/,/agents/contact/7360373/?form-name=details-contact,/agents/branch/knight-frank-city-and-east-residential-development/,False,https://media.onthemarket.com/agents/branches/37782/150609132133033/logo-100x65.jpg,"Knight Frank - City & East, Residential Development",020 8022 6382
