images-count,price-qualifier,new-home-flag,display_address,cover-images-default,cover-images-webp,floorplans-count,summary,property-labels,property-title,id,property-link,cover-image,price,floorplans?,for-sale?,agent-base-contact-url,agent-contact-url,agent-details-url,agent-development?,agent-display-logo-url,agent-id,agent-name,agent-telephone
9,Guide price,True,"St. Ives Place, London, E14",https://media.onthemarket.com/properties/9527875/1323905904/image-0-480x320.jpg,https://media.onthemarket.com/properties/9527875/1323905904/image-0-480x320.webp,1,Ground Floor New Build Apartment | Help To Buy Scheme | Private Terrace | Luxury Studio | Investment Opportunity | Completion December 2020.St Ives Place was first developed in 2016 and we are proud to now present six additional ground floor apartments. This luxurious development has a range of...,['New build'],Studio for sale,9527875,/details/9527875/,https://media.onthemarket.com/properties/9527875/1323905904/image-0-480x320.jpg,"£300,000",True,True,/agents/contact/9527875/,/agents/contact/9527875/?form-name=details-contact,/agents/branch/blueprint-properties-london/,False,https://media.onthemarket.com/agents/companies/8005/180920104655149/logo-100x65.png,48801,Blueprint Properties - London,020 8128 1242
7,Guide price,True,"St. Ives Place, London, E14",https://media.onthemarket.com/properties/9527873/1323905902/image-0-480x320.jpg,https://media.onthemarket.com/properties/9527873/1323905902/image-0-480x320.webp,1,Ground Floor New Build Apartment | Help To Buy Scheme | Private Terrace | Luxury Studio | Investment Opportunity | Completion December 2020.St Ives Place was first developed in 2016 and we are proud to now present six additional ground floor apartments. This luxurious development has a range of...,['New build'],1 bedroom apartment for sale,9527873,/details/9527873/,https://media.onthemarket.com/properties/9527873/1323905902/image-0-480x320.jpg,"£350,000",True,True,/agents/contact/9527873/,/agents/contact/9527873/?form-name=details-contact,/agents/branch/blueprint-properties-london/,False,https://media.onthemarket.com/agents/companies/8005/180920104655149/logo-100x65.png,48801,Blueprint Properties - London,020 8128 1242
7,,True,"The Wardian, East Tower, Canary Wharf, E14",https://media.onthemarket.com/properties/9524013/1333099089/image-0-480x320.jpg,https://media.onthemarket.com/properties/9524013/1333099089/image-0-480x320.webp,3,"Last Chance to Purchase | 46th Floor Studio with 109 Sq Ft  balcony | East Facing | South Dock, Canary Wharf, River Thames and O2 Arena Views | Discounted from Original Purchase Price | 25m Athletic Heated Outdoor Pool | 53rd Level Sky lounge inclusive of Private Dining and Bar | 24Hr Concierge |...",['New build'],Studio for sale,9524013,/details/9524013/,https://media.onthemarket.com/properties/9524013/1333099089/image-0-480x320.jpg,"£500,000",True,True,/agents/contact/9524013/,/agents/contact/9524013/?form-name=details-contact,/agents/branch/mylondonhome/,False,https://media.onthemarket.com/agents/branches/26009/190704130428048/logo-100x65.jpg,26009,MyLondonHome,020 8033 1702
10,,True,"Engine House, Poplar, E14",https://media.onthemarket.com/properties/9519675/1332585099/image-0-480x320.jpg,https://media.onthemarket.com/properties/9519675/1332585099/image-0-480x320.webp,1,"A stunning two bedroom apartment with free parking for one year in Engine House, Carmen Street - an ambitious new development of homes situated adjacent to Langdon Park DLR. Living at Carmen Street, you are connected with all the great galleries, palaces, theatres, museums, clubs and restaurants...",['New build'],2 bedroom apartment for sale,9519675,/details/9519675/,https://media.onthemarket.com/properties/9519675/1332585099/image-0-480x320.jpg,"£450,000",True,True,/agents/contact/9519675/,/agents/contact/9519675/?form-name=details-contact,/agents/branch/dockleys-london-property-london/,False,https://media.onthemarket.com/agents/companies/7785/201222175031108/logo-100x65.jpg,48486,Dockleys London Property - London,020 8033 7485
15,Offers over,True,"Lookout Lane, City Island, Leamouth Peninsula, E14",https://media.onthemarket.com/properties/9512042/1332581044/image-0-480x320.jpg,https://media.onthemarket.com/properties/9512042/1332581044/image-0-480x320.webp,1,2 bedroom duplex apartment | 1009 sq ft | River views and towards Canary Wharf | Private terrace | Secure off street parking | Concierge | Gymnasium | Spa | Swimming pool | on site restaurants | Situated in the sought after City Island  | Jubilee line and DLR | Chain Free | Albion house has an...,['New build'],2 bedroom apartment for sale,9512042,/details/9512042/,https://media.onthemarket.com/properties/9512042/1332581044/image-0-480x320.jpg,"£800,000",True,True,/agents/contact/9512042/,/agents/contact/9512042/?form-name=details-contact,/agents/branch/mylondonhome/,False,https://media.onthemarket.com/agents/branches/26009/190704130428048/logo-100x65.jpg,26009,MyLondonHome,020 8033 1702
24,,True,"Park Drive, Canary Wharf, E14",https://media.onthemarket.com/properties/9501119/1323194960/image-0-480x320.jpg,https://media.onthemarket.com/properties/9501119/1323194960/image-0-480x320.webp,1,"Stunning two bedroom property, with balcony and access to roof terrace gardens and panormaic views - in the heart of Canary Wharf Set on a wonderful waterfront location 10 Park Drive affords panoramic views across South Dock, Canary Wharf and the River Thames beyond. It is a remarkable addition...","['Online viewing', 'New build']",2 bedroom apartment for sale,9501119,/details/9501119/,https://media.onthemarket.com/properties/9501119/1323194960/image-0-480x320.jpg,"£1,090,000",True,True,/agents/contact/9501119/,/agents/contact/9501119/?form-name=details-contact,/agents/branch/cbre-london-canary-wharf/,False,https://media.onthemarket.com/agents/companies/2161/160421100530154/logo-100x65.png,37798,"CBRE Residential - London, Canary Wharf",020 8022 6426
8,Offers over,True,"The Wardian, East Tower, Marsh Wall, Canary Wharf, E14",https://media.onthemarket.com/properties/9500360/1332581056/image-0-480x320.jpg,https://media.onthemarket.com/properties/9500360/1332581056/image-0-480x320.webp,1,"*URGENT SALE REQUIRED* |  Dual Aspect 1014 sq ft apartment | Views of Canary Wharf, The River and City |  Wrap around 401 Sq Ft  private garden terrace' | 25m Athletic Heated Outdoor Pool | 53rd Level Sky lounge inclusive of Private Dining and Bar | 24Hr Concierge | Gym | Spa | 998 years Lease |...",['New build'],2 bedroom apartment for sale,9500360,/details/9500360/,https://media.onthemarket.com/properties/9500360/1332581056/image-0-480x320.jpg,"£950,000",True,True,/agents/contact/9500360/,/agents/contact/9500360/?form-name=details-contact,/agents/branch/mylondonhome/,False,https://media.onthemarket.com/agents/branches/26009/190704130428048/logo-100x65.jpg,26009,MyLondonHome,020 8033 1702
17,Price on application,True,"Apartment 29-04, 10 Park Drive, Canary Wharf, E14",https://media.onthemarket.com/properties/9493898/1337091478/image-0-480x320.jpg,https://media.onthemarket.com/properties/9493898/1337091478/image-0-480x320.webp,1,"Beautiful apartments with excellent transport connections and breathtaking views available at 10 Park Drive  This bright two bedroom apartment which is located on the 29th floor of 10 Park Drive measures 1,114  square foot and benefits from private balconies  and views over Canary Wharf.  Located...","['Online viewing', 'New build']",2 bedroom flat for sale,9493898,/details/9493898/,https://media.onthemarket.com/properties/9493898/1337091478/image-0-480x320.jpg,,True,True,/agents/contact/9493898/,/agents/contact/9493898/?form-name=details-contact,/agents/branch/knight-frank-city-and-east-residential-development/,False,https://media.onthemarket.com/agents/branches/37782/150609132133033/logo-100x65.jpg,37782,"Knight Frank - City & East, Residential Development",020 8022 6382
15,,True,"Apartment 29-02, 10 Park Drive, Canary Wharf, E14",https://media.onthemarket.com/properties/9493896/1337238262/image-0-480x320.jpg,https://media.onthemarket.com/properties/9493896/1337238262/image-0-480x320.webp,1,"A range of studios, 1, 2 & 3 bedroom riverside apartments available on Canary Wharf's private estate.  This bespoke two bedroom apartment which is located on the 29th floor at 10 Park Drive measures 960 square foot and has private 147 square foot balcony and views over the Dome and the South...","['Online viewing', 'New build']",2 bedroom flat for sale,9493896,/details/9493896/,https://media.onthemarket.com/properties/9493896/1337238262/image-0-480x320.jpg,"£1,300,000",True,True,/agents/contact/9493896/,/agents/contact/9493896/?form-name=details-contact,/agents/branch/knight-frank-city-and-east-residential-development/,False,https://media.onthemarket.com/agents/branches/37782/150609132133033/logo-100x65.jpg,37782,"Knight Frank - City & East, Residential Development",020 8022 6382
15,,True,"40-02, 10 Park Drive, Canary Wharf, London, E14",https://media.onthemarket.com/properties/7290056/1337088918/image-0-480x320.jpg,https://media.onthemarket.com/properties/7290056/1337088918/image-0-480x320.webp,1,"Beautiful 3 bedroom apartment with views over South Docks and Canary Wharf  This elegant 3 bedroom riverside apartment which is located on the 40th floor provides 1,335 sq/ft of internal space, two generous balconies, a spacious living area and panoramic views of Canary Wharf and South Dock.  All...","['Online viewing', 'New build']",3 bedroom flat for sale,7290056,/details/7290056/,https://media.onthemarket.com/properties/7290056/1337088918/image-0-480x320.jpg,"£2,300,000",True,True,/agents/contact/7290056/,/agents/contact/7290056/?form-name=details-contact,/agents/branch/knight-frank-city-and-east-residential-development/,False,https://media.onthemarket.com/agents/branches/37782/150609132133033/logo-100x65.jpg,37782,"Knight Frank - City & East, Residential Development",020 8022 6382
18,,True,"38-02 One Park Drive, Canary Wharf, London, E14",https://media.onthemarket.com/properties/7881461/1337056239/image-0-480x320.jpg,https://media.onthemarket.com/properties/7881461/1337056239/image-0-480x320.webp,1,"Beautiful riverside apartments with excellent transport connections available in the heart of Canary Wharf, E14  This bright One bedroom home is located on the 38th floor of the One Park Drive tower and has a North/East aspect,  a private terrace and views over the New District.    Concierge |...","['Online viewing', 'New build']",1 bedroom flat for sale,7881461,/details/7881461/,https://media.onthemarket.com/properties/7881461/1337056239/image-0-480x320.jpg,"£932,500",True,True,/agents/contact/7881461/,/agents/contact/7881461/?form-name=details-contact,/agents/branch/knight-frank-city-and-east-residential-development/,False,https://media.onthemarket.com/agents/branches/37782/150609132133033/logo-100x65.jpg,37782,"Knight Frank - City & East, Residential Development",020 8022 6382
17,Price on application,True,"15-03 One Park Drive, Canary Wharf, London, E14",https://media.onthemarket.com/properties/9493528/1337057388/image-0-480x320.jpg,https://media.onthemarket.com/properties/9493528/1337057388/image-0-480x320.webp,1,"Luxury 1 bedroom apartment available at Canary Wharf's One Park Drive, E14  This luxurious one bedroom apartment, which is located on the 15th floor of the One Park Drive tower, measures 772 square foot and has a 54 square foot private terrace, a North/East aspect and views over the New District....","['Online viewing', 'New build']",1 bedroom flat for sale,9493528,/details/9493528/,https://media.onthemarket.com/properties/9493528/1337057388/image-0-480x320.jpg,,True,True,/agents/contact/9493528/,/agents/contact/9493528/?form-name=details-contact,/agents/branch/knight-frank-city-and-east-residential-development/,False,https://media.onthemarket.com/agents/branches/37782/150609132133033/logo-100x65.jpg,37782,"Knight Frank - City & East, Residential Development",020 8022 6382
23,,True,"14-02 One Park Drive, Canary Wharf, London, E14",https://media.onthemarket.com/properties/5597592/1337057199/image-0-480x320.jpg,https://media.onthemarket.com/properties/5597592/1337057199/image-0-480x320.webp,1,"Beautiful 2 bedroom home for sale at Canary Wharf's One Park Drive, E14  This marvellous 14th floor Two bedroom apartment boasts a North facing terrace, with remarkable views over Compton Gardens & Canary Wharf.  The spacious new home benefits from 948 sq/ ft of internal space and a 84 square...","['Online viewing', 'New build']",2 bedroom flat for sale,5597592,/details/5597592/,https://media.onthemarket.com/properties/5597592/1337057199/image-0-480x320.jpg,"£1,155,000",True,True,/agents/contact/5597592/,/agents/contact/5597592/?form-name=details-contact,/agents/branch/knight-frank-city-and-east-residential-development/,False,https://media.onthemarket.com/agents/branches/37782/150609132133033/logo-100x65.jpg,37782,"Knight Frank - City & East, Residential Development",020 8022 6382
11,,True,"Park Drive, Canary Wharf, London, E14",https://media.onthemarket.com/properties/9481758/1331753277/image-0-480x320.jpg,https://media.onthemarket.com/properties/9481758/1331753277/image-0-480x320.webp,,Brand new one bedroom apartment in Park Drive located on the 12th floor.,"['Online viewing', 'New build']",1 bedroom flat for sale,9481758,/details/9481758/,https://media.onthemarket.com/properties/9481758/1331753277/image-0-480x320.jpg,"£650,000",,True,/agents/contact/9481758/,/agents/contact/9481758/?form-name=details-contact,/agents/branch/gordon-and-co-tower-bridge/,False,https://media.onthemarket.com/agents/companies/1602/150611124408254/logo-100x65.jpg,27549,Gordon & Co - Tower Bridge,020 8022 7279
23,Offers over,True,"Bagshaw Building, The Wardian, Canary Wharf, E14",https://media.onthemarket.com/properties/9470813/1322243397/image-0-480x320.jpg,https://media.onthemarket.com/properties/9470813/1322243397/image-0-480x320.webp,1,3D Virtual Viewing | 840 sq ft Internal | 12th Floor | Additional 346 sq ft Garden Terrace | Double Aspect South & West | 24 Hour Concierge | 25 m Open Air Swimming Pool | Private Cinema | Gym | Residents Lounge | Podium Garden with Outdoor Lounge | Indoor winter Garden | Childrens Play Area |...,"['Online viewing', 'New build']",2 bedroom apartment for sale,9470813,/details/9470813/,https://media.onthemarket.com/properties/9470813/1322243397/image-0-480x320.jpg,"£850,000",True,True,/agents/contact/9470813/,/agents/contact/9470813/?form-name=details-contact,/agents/branch/mylondonhome/,False,https://media.onthemarket.com/agents/branches/26009/190704130428048/logo-100x65.jpg,26009,MyLondonHome,020 8033 1702
37,Offers over,True,"Bagshaw Building, The Wardian, Canary Wharf, E14",https://media.onthemarket.com/properties/9470738/1331184506/image-0-480x320.jpg,https://media.onthemarket.com/properties/9470738/1331184506/image-0-480x320.webp,2,"3D Virtual Viewing | 18th Floor | 1014 sq ft | Views of Canary Wharf, The River and City | Wrap around 401 Sq Ft  private garden terrace' | 25m Athletic Heated Outdoor Pool | 53rd Level Sky lounge inclusive of Private Dining and Bar | 24Hr Concierge | Gym | Spa | 998 years Lease | 0.2 Miles to...","['Online viewing', 'New build']",2 bedroom apartment for sale,9470738,/details/9470738/,https://media.onthemarket.com/properties/9470738/1331184506/image-0-480x320.jpg,"£1,150,000",True,True,/agents/contact/9470738/,/agents/contact/9470738/?form-name=details-contact,/agents/branch/mylondonhome/,False,https://media.onthemarket.com/agents/branches/26009/190704130428048/logo-100x65.jpg,26009,MyLondonHome,020 8033 1702
11,,True,"Defoe House, 123 City Island Way, London, E14",https://media.onthemarket.com/properties/9470707/1322239376/image-0-480x320.jpg,https://media.onthemarket.com/properties/9470707/1322239376/image-0-480x320.webp,1,"This is a fabulous opportunity to become part of the unique London City Island, the latest development in E14. This 17th floor west facing one bedroom boasts unbelievable views of Canary Wharf and The City as well as 555sqft/52sqm of living space. (contd...)","['Online viewing', 'New build']",1 bedroom flat for sale,9470707,/details/9470707/,https://media.onthemarket.com/properties/9470707/1322239376/image-0-480x320.jpg,"£550,000",True,True,/agents/contact/9470707/,/agents/contact/9470707/?form-name=details-contact,/agents/branch/winkworth-bow/,False,https://media.onthemarket.com/agents/branches/27580/150609132059063/logo-100x65.jpg,27580,Winkworth - Bow,020 8033 7438
15,,True,"One Park Drive, Canary Wharf, E14",https://media.onthemarket.com/properties/9466843/1322149811/image-0-480x320.jpg,https://media.onthemarket.com/properties/9466843/1322149811/image-0-480x320.webp,1,"Breathtaking panoramic views over the New District & River Thames; two double bedrooms, two bathrooms over 1000sq ft Breathtaking panoramic views over the New District & River Thames. This beautifully presented two bedroom apartment is situated on the 34th floor of One Park Drive, a landmark...","['Online viewing', 'New build']",2 bedroom apartment for sale,9466843,/details/9466843/,https://media.onthemarket.com/properties/9466843/1322149811/image-0-480x320.jpg,"£1,400,000",True,True,/agents/contact/9466843/,/agents/contact/9466843/?form-name=details-contact,/agents/branch/cbre-london-canary-wharf/,False,https://media.onthemarket.com/agents/companies/2161/160421100530154/logo-100x65.png,37798,"CBRE Residential - London, Canary Wharf",020 8022 6426
12,,True,"Park Drive, Canary Wharf, E14",https://media.onthemarket.com/properties/9466054/1322137384/image-0-480x320.jpg,https://media.onthemarket.com/properties/9466054/1322137384/image-0-480x320.webp,1,"Beautiful home in the heart of Canary Wharf, 29th floor panormaic views, surrounded by parks and waterways Set on a wonderful waterfront location, 10 Park Drive affords panoramic views across South Dock, Canary Wharf and the River Thames beyond. It is a remarkable addition to Canary Wharf’s...","['Online viewing', 'New build']",2 bedroom apartment for sale,9466054,/details/9466054/,https://media.onthemarket.com/properties/9466054/1322137384/image-0-480x320.jpg,"£1,230,000",True,True,/agents/contact/9466054/,/agents/contact/9466054/?form-name=details-contact,/agents/branch/cbre-london-canary-wharf/,False,https://media.onthemarket.com/agents/companies/2161/160421100530154/logo-100x65.png,37798,"CBRE Residential - London, Canary Wharf",020 8022 6426
19,,True,"13.07, The Landmark Pinnacle, Westferry Road, Isle Of Dogs, London, E14",https://media.onthemarket.com/properties/6444706/1336924810/image-0-480x320.jpg,https://media.onthemarket.com/properties/6444706/1336924810/image-0-480x320.webp,1,"Luxury 1 bedroom home with beautiful views and excellent facilities available in Isle of Dogs, E14  This one bedroom apartment which is situated on the 13th floor benefits from 521sq ft of internal space, a 98 square foot winter garden, and has views West and towards the River Thames.  [use...",['New build'],1 bedroom flat for sale,6444706,/details/6444706/,https://media.onthemarket.com/properties/6444706/1336924810/image-0-480x320.jpg,"£615,000",True,True,/agents/contact/6444706/,/agents/contact/6444706/?form-name=details-contact,/agents/branch/knight-frank-city-and-east-residential-development/,False,https://media.onthemarket.com/agents/branches/37782/150609132133033/logo-100x65.jpg,37782,"Knight Frank - City & East, Residential Development",020 8022 6382
19,,True,"42.1 Aspen, Marsh Wall, London, E14",https://media.onthemarket.com/properties/8496504/1334707112/image-0-480x320.jpg,https://media.onthemarket.com/properties/8496504/1334707112/image-0-480x320.webp,1,"Three bedroom riverside apartments benefiting from a selection of amenities & great transport connections at Aspen at Consort Place, E14  This elegant three bedroom apartment is located on the 42nd floor and has Canary Wharf aspect and a private terrace.  Gym | Concierge | Sky Lounge | Wellness...","['Online viewing', 'New build']",3 bedroom flat for sale,8496504,/details/8496504/,https://media.onthemarket.com/properties/8496504/1334707112/image-0-480x320.jpg,"£1,480,000",True,True,/agents/contact/8496504/,/agents/contact/8496504/?form-name=details-contact,/agents/branch/knight-frank-city-and-east-residential-development/,False,https://media.onthemarket.com/agents/branches/37782/150609132133033/logo-100x65.jpg,37782,"Knight Frank - City & East, Residential Development",020 8022 6382
16,,True,"62.2 Aspen, Marsh Wall, London, E14",https://media.onthemarket.com/properties/9451713/1334705133/image-0-480x320.jpg,https://media.onthemarket.com/properties/9451713/1334705133/image-0-480x320.webp,1,"Aspen at Consort Place provides beautiful studios, 1, 2 & 3 bedroom apartments with excellent facilities and transport connections in Canary Wharf  This amazing one bedroom home which is located on the 62nd floor of Aspen at Consort Place offers 594 square foot of space and a Canary Wharf aspect....","['Online viewing', 'New build']",1 bedroom flat for sale,9451713,/details/9451713/,https://media.onthemarket.com/properties/9451713/1334705133/image-0-480x320.jpg,"£888,000",True,True,/agents/contact/9451713/,/agents/contact/9451713/?form-name=details-contact,/agents/branch/knight-frank-city-and-east-residential-development/,False,https://media.onthemarket.com/agents/branches/37782/150609132133033/logo-100x65.jpg,37782,"Knight Frank - City & East, Residential Development",020 8022 6382
16,,True,"26.2 Aspen at Consort Place, Marsh Wall, London, E14",https://media.onthemarket.com/properties/9451621/1334705145/image-0-480x320.jpg,https://media.onthemarket.com/properties/9451621/1334705145/image-0-480x320.webp,1,"Beautiful apartments benefiting from excellent transport connections &  amenities available in Aspen at Consort Place, E14  This bright and airy one bedroom apartment is located on the 26th floor, measures 587 sq/ft  and has an East/North -East & Canary Wharf aspect.  Gym | Concierge | Sky Lounge...","['Online viewing', 'New build']",1 bedroom flat for sale,9451621,/details/9451621/,https://media.onthemarket.com/properties/9451621/1334705145/image-0-480x320.jpg,"£720,000",True,True,/agents/contact/9451621/,/agents/contact/9451621/?form-name=details-contact,/agents/branch/knight-frank-city-and-east-residential-development/,False,https://media.onthemarket.com/agents/branches/37782/150609132133033/logo-100x65.jpg,37782,"Knight Frank - City & East, Residential Development",020 8022 6382
16,,True,"Charrington Tower,  Biscayne Avenue, London",https://media.onthemarket.com/properties/6045468/1321458503/image-0-480x320.jpg,https://media.onthemarket.com/properties/6045468/1321458503/image-0-480x320.webp,1,"A beautiful 2 bedroom, 20th floor apartment in a sought-after development with 2 private Balconies, communal Gym, Pool, concierge and valet Parking, located in the heart of Canary Wharf.",['New build'],1 bedroom apartment for sale,6045468,/details/6045468/,https://media.onthemarket.com/properties/6045468/1321458503/image-0-480x320.jpg,"£995,000",True,True,/agents/contact/6045468/,/agents/contact/6045468/?form-name=details-contact,/agents/branch/idasons-london/,False,https://media.onthemarket.com/agents/companies/8569/190528162303418/logo-100x65.png,49972,Idasons - London,020 8128 9860
