id,images-count,price-qualifier,new-home-flag,display_address,cover-images-default,cover-images-webp,floorplans-count,summary,property-labels,property-title,property-link,cover-image,price,floorplans?,for-sale?,agent-base-contact-url,agent-contact-url,agent-details-url,agent-development?,agent-display-logo-url,agent-id,agent-name,agent-telephone
7881461,18,,True,"38-02 One Park Drive, Canary Wharf, London, E14",https://media.onthemarket.com/properties/7881461/1337056239/image-0-480x320.jpg,https://media.onthemarket.com/properties/7881461/1337056239/image-0-480x320.webp,1,"Beautiful riverside apartments with excellent transport connections available in the heart of Canary Wharf, E14  This bright One bedroom home is located on the 38th floor of the One Park Drive tower and has a North/East aspect,  a private terrace and views over the New District.    Concierge |...","['Online viewing', 'New build']",1 bedroom flat for sale,/details/7881461/,https://media.onthemarket.com/properties/7881461/1337056239/image-0-480x320.jpg,"£932,500",True,True,/agents/contact/7881461/,/agents/contact/7881461/?form-name=details-contact,/agents/branch/knight-frank-city-and-east-residential-development/,False,https://media.onthemarket.com/agents/branches/37782/150609132133033/logo-100x65.jpg,37782,"Knight Frank - City & East, Residential Development",020 8022 6382
9493528,17,Price on application,True,"15-03 One Park Drive, Canary Wharf, London, E14",https://media.onthemarket.com/properties/9493528/1337057388/image-0-480x320.jpg,https://media.onthemarket.com/properties/9493528/1337057388/image-0-480x320.webp,1,"Luxury 1 bedroom apartment available at Canary Wharf's One Park Drive, E14  This luxurious one bedroom apartment, which is located on the 15th floor of the One Park Drive tower, measures 772 square foot and has a 54 square foot private terrace, a North/East aspect and views over the New District....","['Online viewing', 'New build']",1 bedroom flat for sale,/details/9493528/,https://media.onthemarket.com/properties/9493528/1337057388/image-0-480x320.jpg,,True,True,/agents/contact/9493528/,/agents/contact/9493528/?form-name=details-contact,/agents/branch/knight-frank-city-and-east-residential-development/,False,https://media.onthemarket.com/agents/branches/37782/150609132133033/logo-100x65.jpg,37782,"Knight Frank - City & East, Residential Development",020 8022 6382
5597592,23,,True,"14-02 One Park Drive, Canary Wharf, London, E14",https://media.onthemarket.com/properties/5597592/1337057199/image-0-480x320.jpg,https://media.onthemarket.com/properties/5597592/1337057199/image-0-480x320.webp,1,"Beautiful 2 bedroom home for sale at Canary Wharf's One Park Drive, E14  This marvellous 14th floor Two bedroom apartment boasts a North facing terrace, with remarkable views over Compton Gardens & Canary Wharf.  The spacious new home benefits from 948 sq/ ft of internal space and a 84 square...","['Online viewing', 'New build']",2 bedroom flat for sale,/details/5597592/,https://media.onthemarket.com/properties/5597592/1337057199/image-0-480x320.jpg,"£1,155,000",True,True,/agents/contact/5597592/,/agents/contact/5597592/?form-name=details-contact,/agents/branch/knight-frank-city-and-east-residential-development/,False,https://media.onthemarket.com/agents/branches/37782/150609132133033/logo-100x65.jpg,37782,"Knight Frank - City & East, Residential Development",020 8022 6382
9470813,23,Offers over,True,"Bagshaw Building, The Wardian, Canary Wharf, E14",https://media.onthemarket.com/properties/9470813/1322243397/image-0-480x320.jpg,https://media.onthemarket.com/properties/9470813/1322243397/image-0-480x320.webp,1,3D Virtual Viewing | 840 sq ft Internal | 12th Floor | Additional 346 sq ft Garden Terrace | Double Aspect South & West | 24 Hour Concierge | 25 m Open Air Swimming Pool | Private Cinema | Gym | Residents Lounge | Podium Garden with Outdoor Lounge | Indoor winter Garden | Childrens Play Area |...,"['Online viewing', 'New build']",2 bedroom apartment for sale,/details/9470813/,https://media.onthemarket.com/properties/9470813/1322243397/image-0-480x320.jpg,"£850,000",True,True,/agents/contact/9470813/,/agents/contact/9470813/?form-name=details-contact,/agents/branch/mylondonhome/,False,https://media.onthemarket.com/agents/branches/26009/190704130428048/logo-100x65.jpg,26009,MyLondonHome,020 8033 1702
9470738,37,Offers over,True,"Bagshaw Building, The Wardian, Canary Wharf, E14",https://media.onthemarket.com/properties/9470738/1331184506/image-0-480x320.jpg,https://media.onthemarket.com/properties/9470738/1331184506/image-0-480x320.webp,2,"3D Virtual Viewing | 18th Floor | 1014 sq ft | Views of Canary Wharf, The River and City | Wrap around 401 Sq Ft  private garden terrace' | 25m Athletic Heated Outdoor Pool | 53rd Level Sky lounge inclusive of Private Dining and Bar | 24Hr Concierge | Gym | Spa | 998 years Lease | 0.2 Miles to...","['Online viewing', 'New build']",2 bedroom apartment for sale,/details/9470738/,https://media.onthemarket.com/properties/9470738/1331184506/image-0-480x320.jpg,"£1,150,000",True,True,/agents/contact/9470738/,/agents/contact/9470738/?form-name=details-contact,/agents/branch/mylondonhome/,False,https://media.onthemarket.com/agents/branches/26009/190704130428048/logo-100x65.jpg,26009,MyLondonHome,020 8033 1702
9470707,11,,True,"Defoe House, 123 City Island Way, London, E14",https://media.onthemarket.com/properties/9470707/1322239376/image-0-480x320.jpg,https://media.onthemarket.com/properties/9470707/1322239376/image-0-480x320.webp,1,"This is a fabulous opportunity to become part of the unique London City Island, the latest development in E14. This 17th floor west facing one bedroom boasts unbelievable views of Canary Wharf and The City as well as 555sqft/52sqm of living space. (contd...)","['Online viewing', 'New build']",1 bedroom flat for sale,/details/9470707/,https://media.onthemarket.com/properties/9470707/1322239376/image-0-480x320.jpg,"£550,000",True,True,/agents/contact/9470707/,/agents/contact/9470707/?form-name=details-contact,/agents/branch/winkworth-bow/,False,https://media.onthemarket.com/agents/branches/27580/150609132059063/logo-100x65.jpg,27580,Winkworth - Bow,020 8033 7438
9466843,15,,True,"One Park Drive, Canary Wharf, E14",https://media.onthemarket.com/properties/9466843/1322149811/image-0-480x320.jpg,https://media.onthemarket.com/properties/9466843/1322149811/image-0-480x320.webp,1,"Breathtaking panoramic views over the New District & River Thames; two double bedrooms, two bathrooms over 1000sq ft Breathtaking panoramic views over the New District & River Thames. This beautifully presented two bedroom apartment is situated on the 34th floor of One Park Drive, a landmark...","['Online viewing', 'New build']",2 bedroom apartment for sale,/details/9466843/,https://media.onthemarket.com/properties/9466843/1322149811/image-0-480x320.jpg,"£1,400,000",True,True,/agents/contact/9466843/,/agents/contact/9466843/?form-name=details-contact,/agents/branch/cbre-london-canary-wharf/,False,https://media.onthemarket.com/agents/companies/2161/160421100530154/logo-100x65.png,37798,"CBRE Residential - London, Canary Wharf",020 8022 6426
9466054,12,,True,"Park Drive, Canary Wharf, E14",https://media.onthemarket.com/properties/9466054/1322137384/image-0-480x320.jpg,https://media.onthemarket.com/properties/9466054/1322137384/image-0-480x320.webp,1,"Beautiful home in the heart of Canary Wharf, 29th floor panormaic views, surrounded by parks and waterways Set on a wonderful waterfront location, 10 Park Drive affords panoramic views across South Dock, Canary Wharf and the River Thames beyond. It is a remarkable addition to Canary Wharf’s...","['Online viewing', 'New build']",2 bedroom apartment for sale,/details/9466054/,https://media.onthemarket.com/properties/9466054/1322137384/image-0-480x320.jpg,"£1,230,000",True,True,/agents/contact/9466054/,/agents/contact/9466054/?form-name=details-contact,/agents/branch/cbre-london-canary-wharf/,False,https://media.onthemarket.com/agents/companies/2161/160421100530154/logo-100x65.png,37798,"CBRE Residential - London, Canary Wharf",020 8022 6426
6444706,19,,True,"13.07, The Landmark Pinnacle, Westferry Road, Isle Of Dogs, London, E14",https://media.onthemarket.com/properties/6444706/1336924810/image-0-480x320.jpg,https://media.onthemarket.com/properties/6444706/1336924810/image-0-480x320.webp,1,"Luxury 1 bedroom home with beautiful views and excellent facilities available in Isle of Dogs, E14  This one bedroom apartment which is situated on the 13th floor benefits from 521sq ft of internal space, a 98 square foot winter garden, and has views West and towards the River Thames.  [use...",['New build'],1 bedroom flat for sale,/details/6444706/,https://media.onthemarket.com/properties/6444706/1336924810/image-0-480x320.jpg,"£615,000",True,True,/agents/contact/6444706/,/agents/contact/6444706/?form-name=details-contact,/agents/branch/knight-frank-city-and-east-residential-development/,False,https://media.onthemarket.com/agents/branches/37782/150609132133033/logo-100x65.jpg,37782,"Knight Frank - City & East, Residential Development",020 8022 6382
8496504,19,,True,"42.1 Aspen, Marsh Wall, London, E14",https://media.onthemarket.com/properties/8496504/1334707112/image-0-480x320.jpg,https://media.onthemarket.com/properties/8496504/1334707112/image-0-480x320.webp,1,"Three bedroom riverside apartments benefiting from a selection of amenities & great transport connections at Aspen at Consort Place, E14  This elegant three bedroom apartment is located on the 42nd floor and has Canary Wharf aspect and a private terrace.  Gym | Concierge | Sky Lounge | Wellness...","['Online viewing', 'New build']",3 bedroom flat for sale,/details/8496504/,https://media.onthemarket.com/properties/8496504/1334707112/image-0-480x320.jpg,"£1,480,000",True,True,/agents/contact/8496504/,/agents/contact/8496504/?form-name=details-contact,/agents/branch/knight-frank-city-and-east-residential-development/,False,https://media.onthemarket.com/agents/branches/37782/150609132133033/logo-100x65.jpg,37782,"Knight Frank - City & East, Residential Development",020 8022 6382
9451621,16,,True,"26.2 Aspen at Consort Place, Marsh Wall, London, E14",https://media.onthemarket.com/properties/9451621/1337999606/image-0-480x320.jpg,https://media.onthemarket.com/properties/9451621/1337999606/image-0-480x320.webp,2,"Exceptional apartments living amidst a vibrant & cosmopolitan new community with astonishing views available in Aspen at Consort Place.  This elegant One bedroom apartment is located on the 26th floor, measures 587 sq/ft  and has an East/North -East & Canary Wharf aspect.  Gym | Concierge | Sky...","['Online viewing', 'New build']",1 bedroom flat for sale,/details/9451621/,https://media.onthemarket.com/properties/9451621/1337999606/image-0-480x320.jpg,"£720,000",True,True,/agents/contact/9451621/,/agents/contact/9451621/?form-name=details-contact,/agents/branch/knight-frank-city-and-east-residential-development/,False,https://media.onthemarket.com/agents/branches/37782/150609132133033/logo-100x65.jpg,37782,"Knight Frank - City & East, Residential Development",020 8022 6382
6045468,16,,True,"Charrington Tower,  Biscayne Avenue, London",https://media.onthemarket.com/properties/6045468/1321458503/image-0-480x320.jpg,https://media.onthemarket.com/properties/6045468/1321458503/image-0-480x320.webp,1,"A beautiful 2 bedroom, 20th floor apartment in a sought-after development with 2 private Balconies, communal Gym, Pool, concierge and valet Parking, located in the heart of Canary Wharf.",['New build'],1 bedroom apartment for sale,/details/6045468/,https://media.onthemarket.com/properties/6045468/1321458503/image-0-480x320.jpg,"£995,000",True,True,/agents/contact/6045468/,/agents/contact/6045468/?form-name=details-contact,/agents/branch/idasons-london/,False,https://media.onthemarket.com/agents/companies/8569/190528162303418/logo-100x65.png,49972,Idasons - London,020 8128 9860
9439520,12,,True,"One Park Drive, Canary Wharf, E14",https://media.onthemarket.com/properties/9439520/1321303612/image-0-480x320.jpg,https://media.onthemarket.com/properties/9439520/1321303612/image-0-480x320.webp,1,"Stunning one bedroom home in the heart of Canary Wharf, E14 - 19th floor and meticulously finished! The apartment has been carefully finished to a high standard with natural materials and finishes throughout. The apartment comprises a large, open plan kitchen living and dining area, a spacious...","['Online viewing', 'New build']",1 bedroom apartment for sale,/details/9439520/,https://media.onthemarket.com/properties/9439520/1321303612/image-0-480x320.jpg,"£860,000",True,True,/agents/contact/9439520/,/agents/contact/9439520/?form-name=details-contact,/agents/branch/cbre-london-canary-wharf/,False,https://media.onthemarket.com/agents/companies/2161/160421100530154/logo-100x65.png,37798,"CBRE Residential - London, Canary Wharf",020 8022 6426
9439402,6,,True,"One Park Drive, Canary Wharf, E14",https://media.onthemarket.com/properties/9439402/1321300494/image-0-480x320.jpg,https://media.onthemarket.com/properties/9439402/1321300494/image-0-480x320.webp,1,"Luxury two bedroom loft apartment, with a sweeping wrap around terrace in One Park Drive E14 The apartment comprises a large, open plan kitchen in a walnut finish and fully integrated Siemens appliances, main bedroom with dressing area and generous ensuite including a circular, free standing...","['Online viewing', 'New build']",2 bedroom apartment for sale,/details/9439402/,https://media.onthemarket.com/properties/9439402/1321300494/image-0-480x320.jpg,"£1,365,000",True,True,/agents/contact/9439402/,/agents/contact/9439402/?form-name=details-contact,/agents/branch/cbre-london-canary-wharf/,False,https://media.onthemarket.com/agents/companies/2161/160421100530154/logo-100x65.png,37798,"CBRE Residential - London, Canary Wharf",020 8022 6426
9436198,14,,True,"Park Drive, Canary Wharf, E14",https://media.onthemarket.com/properties/9436198/1320860263/image-0-480x320.jpg,https://media.onthemarket.com/properties/9436198/1320860263/image-0-480x320.webp,1,"Stunning West facing two bedroom property in the heart of Canary Wharf - 29th floor panoramic views! Set on a wonderful waterfront location 10 Park Drive affords panoramic views across South Dock, Canary Wharf and the River Thames beyond. It is a remarkable addition to Canary Wharf’s already...",['New build'],2 bedroom apartment for sale,/details/9436198/,https://media.onthemarket.com/properties/9436198/1320860263/image-0-480x320.jpg,"£1,485,000",True,True,/agents/contact/9436198/,/agents/contact/9436198/?form-name=details-contact,/agents/branch/cbre-london-canary-wharf/,False,https://media.onthemarket.com/agents/companies/2161/160421100530154/logo-100x65.png,37798,"CBRE Residential - London, Canary Wharf",020 8022 6426
9435653,13,,True,"Park Drive, Canary Wharf, E14",https://media.onthemarket.com/properties/9435653/1322134280/image-0-480x320.jpg,https://media.onthemarket.com/properties/9435653/1322134280/image-0-480x320.webp,1,"River Thames views and afternoon sunshine - stunning two double bedroo, two bathroom 29th floor luxury home A brand new two bedroom apartment with private balcony set in a waterfront location in the heart of the desirable Canary Wharf, private estate. This apartment is situated on the 29th floor...","['Online viewing', 'New build']",2 bedroom apartment for sale,/details/9435653/,https://media.onthemarket.com/properties/9435653/1322134280/image-0-480x320.jpg,"£1,300,000",True,True,/agents/contact/9435653/,/agents/contact/9435653/?form-name=details-contact,/agents/branch/cbre-london-canary-wharf/,False,https://media.onthemarket.com/agents/companies/2161/160421100530154/logo-100x65.png,37798,"CBRE Residential - London, Canary Wharf",020 8022 6426
9413211,7,,True,"Royal Captain Court, Blackwall Reach, London, E14",https://media.onthemarket.com/properties/9413211/1336820383/image-0-480x320.jpg,https://media.onthemarket.com/properties/9413211/1336820383/image-0-480x320.webp,,"Last one bedroom apartment for sale offering partial river views on the 16th floor of Royal Captain Court, Blackwall Reach, E14. Help to Buy Available!Situated on the 16th floor of Royal Captain Court and extending to 627 sq. ft is this one bedroom West facing apartment. Featuring a winter garden...","['Online viewing', 'New build']",1 bedroom apartment for sale,/details/9413211/,https://media.onthemarket.com/properties/9413211/1336820383/image-0-480x320.jpg,"£560,000",,True,/agents/contact/9413211/,/agents/contact/9413211/?form-name=details-contact,/agents/branch/cbre-london-canary-wharf/,False,https://media.onthemarket.com/agents/companies/2161/160421100530154/logo-100x65.png,37798,"CBRE Residential - London, Canary Wharf",020 8022 6426
9412105,8,,True,"Wards Place, London, E14",https://media.onthemarket.com/properties/9412105/1323219565/image-0-480x320.jpg,https://media.onthemarket.com/properties/9412105/1323219565/image-0-480x320.webp,1,"46th floor studio reassignment apartment for sale MOTIVATED SELLER 46th floor studio apartment offering panoramic views across London. This off- plan apartment (309 Sq. Ft) with a 109 Sq.Ft garden terrace, in the East Tower.In the midst of the skyscrapers and waterways of Canary Wharf, Wardian...",['New build'],Studio for sale,/details/9412105/,https://media.onthemarket.com/properties/9412105/1323219565/image-0-480x320.jpg,"£499,999",True,True,/agents/contact/9412105/,/agents/contact/9412105/?form-name=details-contact,/agents/branch/cbre-london-canary-wharf/,False,https://media.onthemarket.com/agents/companies/2161/160421100530154/logo-100x65.png,37798,"CBRE Residential - London, Canary Wharf",020 8022 6426
9269845,16,Offers in region of,True,"Modena House, London City Island, E14",https://media.onthemarket.com/properties/9269845/1315885009/image-0-480x320.jpg,https://media.onthemarket.com/properties/9269845/1315885009/image-0-480x320.webp,,"A stunning one bedroom apartment within the sought after London City Island development. The development features 24-hour concierge, swimming pool and wellness facilities alongside landscaped gardens, ensuring residents have all they need on The Island. The addition of the English Ballet Theatre...",['New build'],1 bedroom apartment for sale,/details/9269845/,https://media.onthemarket.com/properties/9269845/1315885009/image-0-480x320.jpg,"£500,000",,True,/agents/contact/9269845/,/agents/contact/9269845/?form-name=details-contact,/agents/branch/dockleys-london-property-london/,False,https://media.onthemarket.com/agents/companies/7785/201222175031108/logo-100x65.jpg,48486,Dockleys London Property - London,020 8033 7485
4679472,12,,True,"Lyell Street, City Island, Leymouth Peninsula, E14",https://media.onthemarket.com/properties/4679472/1337277567/image-0-480x320.jpg,https://media.onthemarket.com/properties/4679472/1337277567/image-0-480x320.webp,1,"13th floor | 837 sq ft | Dual Aspect | Stunning views of The River Thames, O2, Canary Wharf and Royal Docks | Private balcony |  Secure off street parking | Concierge | Gymnasium | Spa | Swimming pool | on site restaurants | Situated in the sought after City Island  | Jubilee line and DLR | Chain...",['New build'],2 bedroom apartment for sale,/details/4679472/,https://media.onthemarket.com/properties/4679472/1337277567/image-0-480x320.jpg,"£800,000",True,True,/agents/contact/4679472/,/agents/contact/4679472/?form-name=details-contact,/agents/branch/mylondonhome/,False,https://media.onthemarket.com/agents/branches/26009/190704130428048/logo-100x65.jpg,26009,MyLondonHome,020 8033 1702
9380918,6,Offers over,True,"One Park Drive, Canary Wharf, E14",https://media.onthemarket.com/properties/9380918/1332581051/image-0-480x320.jpg,https://media.onthemarket.com/properties/9380918/1332581051/image-0-480x320.webp,2,AMAZING VALUE | Amazing Studio with South Dock Views | 16th floor | 435 Sq Ft or 40.4 Sq m | 54 sq ft Balcony |  South East Aspect | Situated on Canary Wharf Estate | 24 Hr Concierge | Gym | Swimming Pool | Jacuzzi | Sauna | Private Residents Club | Best located development in E14 | New Wood...,['New build'],Studio for sale,/details/9380918/,https://media.onthemarket.com/properties/9380918/1332581051/image-0-480x320.jpg,"£550,000",True,True,/agents/contact/9380918/,/agents/contact/9380918/?form-name=details-contact,/agents/branch/mylondonhome/,False,https://media.onthemarket.com/agents/branches/26009/190704130428048/logo-100x65.jpg,26009,MyLondonHome,020 8033 1702
9375497,14,Offers over,True,"Modena House, 19 Lyell Street, City Island, Leymouth Peninsula, E14",https://media.onthemarket.com/properties/9375497/1332546552/image-0-480x320.jpg,https://media.onthemarket.com/properties/9375497/1332546552/image-0-480x320.webp,,"19th floor | 574 sq ft | Dual Aspect | Spectacular views of The River Thames,  and Canary Wharf | Large private balcony |  Concierge | Gymnasium | Spa | Swimming pool | on site restaurants | Situated in the sought after City Island  | Jubilee line and DLR | Chain Free | Modena House  has an EWS1...",['New build'],1 bedroom apartment for sale,/details/9375497/,https://media.onthemarket.com/properties/9375497/1332546552/image-0-480x320.jpg,"£500,000",,True,/agents/contact/9375497/,/agents/contact/9375497/?form-name=details-contact,/agents/branch/mylondonhome/,False,https://media.onthemarket.com/agents/branches/26009/190704130428048/logo-100x65.jpg,26009,MyLondonHome,020 8033 1702
9349318,9,Offers over,True,"One Park Drive, Canary Wharf, E14",https://media.onthemarket.com/properties/9349318/1331415415/image-0-480x320.jpg,https://media.onthemarket.com/properties/9349318/1331415415/image-0-480x320.webp,2,Prestigious Loft Apartment | Huge 1665 sq. ft | 531 Sq Ft Terrace | Exceptional Ceiling Height | Allocated Parking Space with Hyper Charging Point | Storage Unit (80 Sq ft) | 24 Hour Concierge | Incredible 5* Facilities | 20m Swimming Pool | Steam Room | Sauna | Gymnasium | Lounge | Cinema |...,"['New build', 'EV charger']",3 bedroom apartment for sale,/details/9349318/,https://media.onthemarket.com/properties/9349318/1331415415/image-0-480x320.jpg,"£2,000,000",True,True,/agents/contact/9349318/,/agents/contact/9349318/?form-name=details-contact,/agents/branch/mylondonhome/,False,https://media.onthemarket.com/agents/branches/26009/190704130428048/logo-100x65.jpg,26009,MyLondonHome,020 8033 1702
4679470,15,,True,"Lyell Street, City Isand, Leymouth Peninsula, E14",https://media.onthemarket.com/properties/4679470/1337277421/image-0-480x320.jpg,https://media.onthemarket.com/properties/4679470/1337277421/image-0-480x320.webp,1,15th floor | 838 sq ft | Dual Aspect | North East aspect | Stunning Views of London and Canary Wharf |Private balcony | Secure off street parking |  Concierge | Gymnasium | Spa | Swimming pool | on site restaurants | Situated in the sought after City Island  | Jubilee line and DLR |Chain Free |...,['New build'],2 bedroom apartment for sale,/details/4679470/,https://media.onthemarket.com/properties/4679470/1337277421/image-0-480x320.jpg,"£755,000",True,True,/agents/contact/4679470/,/agents/contact/4679470/?form-name=details-contact,/agents/branch/mylondonhome/,False,https://media.onthemarket.com/agents/branches/26009/190704130428048/logo-100x65.jpg,26009,MyLondonHome,020 8033 1702
